
<!DOCTYPE html>
<html lang="en" >
<head>
	<!-- Meta Tags -->

<title>MMM Stock | News | 3M Stock Price Today | Analyst Opinions | Markets Insider</title>
<meta charset="utf-8" />
<meta name="viewport" content="width=device-width, initial-scale=1" />
<meta name="theme-color" content="#ffffff" />
<meta name="title" content="MMM Stock | News | 3M Stock Price Today | Analyst Opinions | Markets Insider" />
<meta property="og:title" content="MMM Stock | News | 3M Stock Price Today | Analyst Opinions | Markets Insider" />
<meta property="twitter:title" content="MMM Stock | News | 3M Stock Price Today | Analyst Opinions | Markets Insider" />
		<meta name="description" content="MMM: Get the latest 3M stock price and detailed information including MMM news, historical charts and realtime prices.
" />
		<meta property="og:description" content="MMM: Get the latest 3M stock price and detailed information including MMM news, historical charts and realtime prices.
" />
		<meta name="twitter:description" content="MMM: Get the latest 3M stock price and detailed information including MMM news, historical charts and realtime prices.
" />

	<meta property="og:image" content="http://markets.businessinsider.com/Images/FacebookIcon.jpg" />
	<meta name="Googlebot-News" content="NOINDEX,FOLLOW">
<meta name="author" content="finanzen.net GmbH">
<meta name="Publisher" content="finanzen.net GmbH" />
<meta name="Copyright" content="finanzen.net GmbH" />
<meta name="Robots" content="INDEX,FOLLOW" />
<meta http-equiv="X-UA-Compatible" content="IE=edge" />
<meta name="page-topic" content="Finanzen" />
<meta name="page-type" content="Kommerzielle Homepage" />
<meta name="audience" content="Alle" />
<meta name="verify-v1" content="O7IlH7Qai/tL0iF1rHcx2JJ8p+LJIZjfS+ylSLqaxm4=" />
<meta name="google-site-verification" content="mZUp2IbDqdTBhra_E0ZqOG4NW0GuABzSMO9mcAXDJ9E" />
<meta name="pocket-site-verification" content="6efc6eae0393e106a6d1d377acc83e" />
<meta property="og:site_name" content="markets.businessinsider.com" />
<meta property="fb:page_id" content="1669622843355246" />
<meta property="fb:pages" content="20446254070" />
<meta property="og:type" content="article" />
<meta property="og:url" content="https://markets.businessinsider.com/stocks/mmm-stock"/>
<link title="markets.businessinsider.com" rel="search" type="application/opensearchdescription+xml" href="/opensearch.xml">


<link rel="apple-touch-icon" sizes="180x180" href="/apple-touch-icon.png">
<link rel="icon" type="image/png" href="/favicon-32x32.png" sizes="32x32">
<link rel="icon" type="image/png" href="/favicon-16x16.png" sizes="16x16">
<link rel="manifest" href="/manifest.json">
<link rel="mask-icon" href="/safari-pinned-tab.svg" color="#014889">


	<!-- PreLoads -->

<link rel="preload" href="/Content/dist/fonts/LabGrotesqueBlack-Subset.woff2" as="font" type="font/woff2" crossorigin>
<link rel="preload" href="/Content/dist/fonts/LabGrotesqueBold-Subset.woff2" as="font" type="font/woff2" crossorigin>
<link rel="preload" href="/Content/dist/fonts/LabGrotesqueRegular-Subset.woff2" as="font" type="font/woff2" crossorigin>
<link rel="preload" href="/Content/dist/fonts/PTSans-Regular-Subset.woff2" as="font" type="font/woff2" crossorigin>
<link rel="preload" href="/Content/dist/fonts/TiemposText-Regular-Subset.woff2" as="font" type="font/woff2" crossorigin>
<link rel="preload" href="/Content/dist/fonts/TiemposText-Bold-Subset.woff2" as="font" type="font/woff2" crossorigin>
<link rel="preload" href="/Content/dist/fonts/TiemposText-BoldItalic-Subset.woff2" as="font" type="font/woff2" crossorigin>
<link rel="preload" href="/Content/dist/fonts/TiemposText-Italic-Subset.woff2" as="font" type="font/woff2" crossorigin>
<link rel="preload" href="/Content/dist/fonts/icon.woff2?v=370768254" as="font" type="font/woff2" crossorigin>
<link rel="preload" href="/Content/dist/images/business-insider-logo.svg" as="image">
<link rel="preload" href="/Content/dist/images/insider-intelligence-logo.svg" as="image">
<link rel="preload" href="/Content/dist/images/insider-logo.svg" as="image">
<link rel="preload" href="/Content/dist/images/markets-insider-logo.svg" as="image">


<link rel="dns-prefetch" href="//pproxy.markets.businessinsider.com">
<link rel="dns-prefetch" href="//images.finanzen.net">
<link rel="dns-prefetch" href="//www.google-analytics.com">
<link rel="dns-prefetch" href="//www.googletagservices.com">
<link rel="dns-prefetch" href="//www.googletagmanager.com">
<link rel="dns-prefetch" href="//cdn.krxd.net">
<link rel="dns-prefetch" href="//beacon.krxd.net">
<link rel="dns-prefetch" href="//usermatch.krxd.net">
<link rel="dns-prefetch" href="//js-agent.newrelic.com">
<link rel="dns-prefetch" href="//data.dianomi.com">
<link rel="dns-prefetch" href="//ping.chartbeat.net">
<link rel="dns-prefetch" href="//static.chartbeat.com">

<link rel="preconnect" href="//cdn.privacy-mgmt.com">
<link rel="preconnect" href="//cdn.tinypass.com">
<link rel="preconnect" href="//htlbid.com">
<link rel="preconnect" href="//cdn.permutive.com">
<link rel="preconnect" href="//live.sekindo.com">
<link rel="preconnect" href="//dianomi.com">
	<!-- Stylesheet -->

<link href="/Content/dist/styles-shares-details.css?v=b9adf487" rel="stylesheet" title="" type="text/css" />
<link rel="stylesheet" type="text/css" href="https://htlbid.com/v3/marketsinsider.com/htlbid.css" />
<link href="/cache/css/chartiq/stx-chart.css?v=b9adf487" rel="stylesheet" title="" type="text/css" />


<noscript>
	<style>
		#piano-inline-content-wrapper {
			display: none !important;
		}

		.piano-freemium {
			display: block !important;
		}

		#piano-inline-slideshow-wrapper {
			display: none !important;
		}
	</style>
</noscript>

	<!-- JavaScript -->


	<script defer="defer" src="/Content/Scripts/jquery-1.11.3.min.js?v=b9adf487"></script><script defer="defer" src="/Content/Scripts/jquery.lazy-master/jquery.lazy.min.js?v=b9adf487"></script><script defer="defer" src="/Content/Scripts/jquery-ui.min.js?v=b9adf487"></script><script defer="defer" src="/Content/Scripts/mmsuggest.js?v=b9adf487"></script>
<script defer="defer" src="/Content/Scripts/MDSnG/libs/socket.io.js?v=b9adf487"></script>
<script defer="defer" src="/Content/Scripts/MDSnG/Config.min.js?v=b9adf487"></script>
<script defer="defer" src="/Content/Scripts/MDSnG/min/clientApiCore.min.js?v=b9adf487"></script>
<script defer="defer" src="/Content/Scripts/MDSnG/min/clientApiLibs.min.js?v=b9adf487"></script>





<script async="async" defer="defer" src="/Content/dist/scripts-shares-details.js?v=b9adf487"></script>

<script>
		var FinandoJsEnvironment = {  VersionNumber : "7", CurrencySeparator : ",", RegexForDateValidation : /^\d{1,2}\/\d{1,2}\/\d{4}$/, RegexForEmailValidation : /^[a-zA-Z0-9._%+-]+@[a-zA-Z0-9.-]+\.[a-zA-Z]{2,4}$/ }
		var isDevelopmentMode = 'False' === 'True';
		var idleNotify = {
			time: '10',
			href: '/notify',
			isEnabled: 'False'
		};
</script>

<script>
	var permutiveConfigurations = {
		permutivePageType: 'quote',
		pageType: 'markets',
		topSection: 'shares',
		disableHtlbid: false,
		isHome: false
	};
</script>
<script>
	// tinypass library informations
	window.loadTinpass = false;

// general time informations
timestamp = '202112291458067069';
utcTimeOffsetToApplication = '-5';
isApplicationTimeByUser = 'False';

// MostViewedInstruments
window.mostViewedInstrumentsData = '{ "Encoding" : { "_t" : "Latin1Encoding", "EncoderFallback" : { "_t" : "InternalEncoderBestFitFallback" }, "DecoderFallback" : { "_t" : "InternalDecoderBestFitFallback" } }, "ShortName" : "3M", "URL" : "/stocks/mmm-stock", "LastPrice" : null, "ChangeAbsolute" : null, "ChangePercentage" : null, "Date" : null, "Identifier" : "VVM4ODU3OVkxMDEw", "Symbol" : "MMM", "InstrumentTypeID" : 3 }';

// variables for mmssuggest, see suggest-search.js
window.mmURLBase = "/ajax/SearchController_Suggest";
window.mmURLIcons = "https://images.finanzen.net/images/b_mmsuggest/";
window.InstrumentPageRoutes = {
	Fund: "/funds/",
    ETF: "/etfs/",
    Share: "/stocks/",
    Bond: "/bonds/",
    Index: "/index/",
    Commodity: "/commodities/",
    InterestRate: "/rates/",
    Derivative: "//",
    ExchangeRate: "/currencies/",
    PrivateCompany: "/private-company/"

	};
  window.InstrumentTypeNames = {
    Fund: "Funds",
    ETF: "ETFs",
    Share: "Stocks",
    Bond: "Bonds",
    Index: "Indices",
    Commodity: "Commodities",
    InterestRate: "Interest Rates",
    Derivative: "Derivatives",
    ExchangeRate: "Currencies",
    PrivateCompany: "Private Companies"
  };
</script>

<noscript>
	<style>
		[data-simplebar] {
			overflow: auto;
		}
	</style>
</noscript>



	<!-- Sections for news, tracking and canonicals -->
		<link rel="canonical" href="https://markets.businessinsider.com/stocks/mmm-stock" />




</head>
<body>
	<!-- DevisedLabs Very Large Image LCP Hack -->
	<img src="data:image/svg+xml;base64,PD94bWwgdmVyc2lvbj0iMS4wIiBlbmNvZGluZz0iVVRGLTgiPz48c3ZnIHdpZHRoPSI5OTk5OXB4IiBoZWlnaHQ9Ijk5OTk5cHgiIHZpZXdCb3g9IjAgMCA5OTk5OSA5OTk5OSIgdmVyc2lvbj0iMS4xIiB4bWxucz0iaHR0cDovL3d3dy53My5vcmcvMjAwMC9zdmciIHhtbG5zOnhsaW5rPSJodHRwOi8vd3d3LnczLm9yZy8xOTk5L3hsaW5rIj48ZyBzdHJva2U9Im5vbmUiIGZpbGw9Im5vbmUiIGZpbGwtb3BhY2l0eT0iMCI+PHJlY3QgeD0iMCIgeT0iMCIgd2lkdGg9Ijk5OTk5IiBoZWlnaHQ9Ijk5OTk5Ij48L3JlY3Q+IDwvZz4gPC9zdmc+" alt="" width="99999" height="99999" style="pointer-events: none; position: absolute; top: 0; left: 0; width: 99vw; height: 99vh; max-width: 99vw; max-height: 99vh;" />

<noscript>
<iframe src="//www.googletagmanager.com/ns.html?id=GTM-MBTPXX" height="0" width="0" style="display: none; visibility: hidden"></iframe>
</noscript>
<script>
!function (e, t, a, n, g) { e[n] = e[n] || [], e[n].push({ "gtm.start": (new Date).getTime(), event: "gtm.js" }); var m = t.getElementsByTagName(a)[0], r = t.createElement(a); r.async = !0, r.src = "//www.googletagmanager.com/gtm.js?id=GTM-MBTPXX", m.parentNode.insertBefore(r, m) }(window, document, "script", "dataLayer");
</script>

		<div class="htlad-mobile_header"
				 data-htlad="true"
				 data-unit="Markets-Insider/Stocks/Homepage"
				 data-prebid="0x0:IAS|768x0:"></div>


		<div class="htlad-mobile_sticky_lower"
				 data-htlad="true"
				 data-unit="Markets-Insider/Stocks/Homepage"
				 data-prebid="0x0:Stocks/Homepage/mobile_leaderboard|768x0:"></div>

	<!-- Markets Insider Page Header -->
	<div class="graviton">
		<header class="site-header site-header--overlay">
	<!-- Logo Row -->
	<div class="site-header__first-row">
		<!-- Menu Button -->
		<div class="site-header__menu-button">
			<button class="button button--icon-only button--border-hidden button--size-large button--hover-blue" data-side-panel-open="navigation-region" data-side-panel-close="login">
				<span class="icon icon-menu"></span>
			</button>
		</div>

		<div class="site-header__i-logo">
			<a href="https://www.insider.com/" class="logo logo-insider" title="Insider">Insider</a>
		</div>

		<!-- Markets Insider Logo -->
		<div class="site-header__mi-logo">
			<a href="https://markets.businessinsider.com/" class="logo logo-markets-insider logo--size-auto" title="Markets Insider">Markets Insider</a>
		</div>

		<!-- Search Formular -->
		<div class="site-header__search">
			<form name="mmssearch" class="width-l-100-percent width-m-100-percent width-s-100-percent" action="/searchresults" method="GET" role="search">
				<div class="input-group input-group--stretch">
					<input name="_search" type="text" class="input-group__text-input" placeholder="Search markets" autocomplete="off">
					<div class="input-group__append">
						<span class="icon icon-search"></span>
					</div>
				</div>
				<div class="desktop-results"></div>
			</form>
		</div>

		<!-- Log In & Subscribe Button -->
		<div class="site-header__actions">
			<a href="#" class="site-header__log-in button button--icon-only button--border-hidden" data-side-panel-open="login" data-side-panel-close="navigation-region">
				<span class="icon icon-user"></span>
			</a>
			<a href="https://www.businessinsider.com/subscription/prime?utm_source=markets" class="site-header__subscribe button button--pill button--size-small" target="_blank" title="Subscribe">Subscribe</a>
		</div>
	</div>

	<!-- Menu Row -->
	<div class="site-header__second-row">
		<!-- Top Menu -->
		<nav class="site-header__top-menu">

<ul class="top-menu">
					<li class="top-menu__item " data-id="1">
						<a href="/" title="Markets"  class="top-menu__link">
							Markets
						</a>
					</li>
					<li class="top-menu__item top-menu__item--active" data-id="2">
						<a href="/stocks" title="Stocks"  class="top-menu__link">
							Stocks
						</a>
					</li>
					<li class="top-menu__item " data-id="3">
						<a href="/indices" title="Indices"  class="top-menu__link">
							Indices
						</a>
					</li>
					<li class="top-menu__item " data-id="4">
						<a href="/commodities" title="Commodities"  class="top-menu__link">
							Commodities
						</a>
					</li>
					<li class="top-menu__item " data-id="5">
						<a href="/cryptocurrencies" title="Cryptocurrencies"  class="top-menu__link">
							Cryptocurrencies
						</a>
					</li>
					<li class="top-menu__item " data-id="6">
						<a href="/currencies" title="Currencies"  class="top-menu__link">
							Currencies
						</a>
					</li>
					<li class="top-menu__item " data-id="7">
						<a href="/etfs" title="ETFs"  class="top-menu__link">
							ETFs
						</a>
					</li>
					<li class="top-menu__item " data-id="9">
						<a href="/news" title="News"  class="top-menu__link">
							News
						</a>
					</li>
</ul>
		</nav>

		<!-- Calendar -->
		<div class="site-header__calendar">
			<div class="dropdown">
				<button class="dropdown__trigger button button--icon-only button--border-hidden button--hover-blue">
					<span class="icon icon-calendar"></span>
				</button>
				<div class="dropdown__content listing">
					<ul class="listing__list">
						<li class="listing__item"><span class="listing__text"><a href="/economic-calendar" class="listing__link" title="Economic">Economic</a></span></li>
						<li class="listing__item"><span class="listing__text"><a href="/earnings-calendar" class="listing__link" title="Earnings">Earnings</a></span></li>
					</ul>
				</div>
			</div>
		</div>
	</div>

	<!-- Markets Now Row -->
	<div class="site-header__third-row">
		<div class="site-header__markets-now-section">
			<script>
  window.marketsNowSections = window.marketsNowSections || { configs: [] };
  window.marketsNowSections.configs.push({
  	regionSelector: '#markets-now-section',
    repalceNode: true,
  	marketsNowSection: {"isOutOfMarketTime":true,"showFutures":true,"caption":{"doesMarketOpenToday":true,"marketOpenTime":"2021-12-29T17:27:56.3606187Z","marketOpenTimeMillies":1923639.3813,"captionText":"U.S. markets open in 32 minutes 3 seconds","captionLink":"/premarket","isShown":true},"clientApiVariable":"clientApiHandler","values":[{"label":"DOW 30","mobileHiddenLabel":null,"url":"/index/dow_jones","premarketObject":{"label":"Dow","mobileHiddenLabel":"Futures","url":"/futures/dow-futures","premarketObject":null,"valuePushApi":{"pushApiLibrary":"clientApiHandler","pushIdentifier":"Y0101313000998313","pushDataField":"Last","pushRoomIdentifier":null,"template":null,"table":7,"time":null},"relativeValue":-0.02756,"absoluteValue":-10.00000,"currentValue":36270.00000,"previousClose":36282.00000,"roundedCurrent":0,"roundedAbsolute":0,"chartData":null,"RelativeValueText":"-0.03%","AbsoluteValueText":"-10.00","CurrentValueText":"36,270.00"},"valuePushApi":{"pushApiLibrary":"clientApiHandler","pushIdentifier":"Y0101136000998313","pushDataField":"Last","pushRoomIdentifier":null,"template":null,"table":7,"time":null},"relativeValue":0.26398,"absoluteValue":95.83000,"currentValue":36398.21000,"previousClose":36398.21000,"roundedCurrent":2,"roundedAbsolute":2,"chartData":null,"RelativeValueText":"-0.03%","AbsoluteValueText":"-10.00","CurrentValueText":"36,270.00"},{"label":"S&P 500","mobileHiddenLabel":null,"url":"/index/s&p_500","premarketObject":{"label":"S&P","mobileHiddenLabel":"Futures","url":"/futures/s&p-500-futures","premarketObject":null,"valuePushApi":{"pushApiLibrary":"clientApiHandler","pushIdentifier":"Y01010EA000712045","pushDataField":"Last","pushRoomIdentifier":null,"template":null,"table":7,"time":null},"relativeValue":-0.08889,"absoluteValue":-4.25000,"currentValue":4776.75000,"previousClose":4778.50000,"roundedCurrent":0,"roundedAbsolute":0,"chartData":null,"RelativeValueText":"-0.09%","AbsoluteValueText":"-4.25","CurrentValueText":"4,776.75"},"valuePushApi":{"pushApiLibrary":"clientApiHandler","pushIdentifier":"Y0101423000998434","pushDataField":"Last","pushRoomIdentifier":null,"template":null,"table":7,"time":null},"relativeValue":-0.10102,"absoluteValue":-4.84000,"currentValue":4786.35000,"previousClose":4786.35000,"roundedCurrent":2,"roundedAbsolute":2,"chartData":null,"RelativeValueText":"-0.09%","AbsoluteValueText":"-4.25","CurrentValueText":"4,776.75"},{"label":"NASDAQ","mobileHiddenLabel":"100","url":"/index/nasdaq_100","premarketObject":{"label":"NASDAQ","mobileHiddenLabel":"Futures","url":"/futures/nasdaq-100-futures","premarketObject":null,"valuePushApi":{"pushApiLibrary":"clientApiHandler","pushIdentifier":"Y01010EA000821881","pushDataField":"Last","pushRoomIdentifier":null,"template":null,"table":7,"time":null},"relativeValue":-0.19985,"absoluteValue":-33.00000,"currentValue":16479.50000,"previousClose":16488.00000,"roundedCurrent":0,"roundedAbsolute":0,"chartData":null,"RelativeValueText":"-0.20%","AbsoluteValueText":"-33.00","CurrentValueText":"16,479.50"},"valuePushApi":{"pushApiLibrary":"clientApiHandler","pushIdentifier":"Y010146F000985336","pushDataField":"Last","pushRoomIdentifier":null,"template":null,"table":7,"time":null},"relativeValue":-0.47586,"absoluteValue":-78.83886,"currentValue":16488.66131,"previousClose":16488.66131,"roundedCurrent":2,"roundedAbsolute":2,"chartData":null,"RelativeValueText":"-0.20%","AbsoluteValueText":"-33.00","CurrentValueText":"16,479.50"},{"label":"Gold","mobileHiddenLabel":null,"url":"/commodities/gold-price","premarketObject":null,"valuePushApi":{"pushApiLibrary":"clientApiHandler","pushIdentifier":"Y0306000000XAU-USD","pushDataField":"Mid","pushRoomIdentifier":null,"template":null,"table":7,"time":null},"relativeValue":-0.83063,"absoluteValue":-15.00000,"currentValue":1790.85000,"previousClose":1805.85000,"roundedCurrent":2,"roundedAbsolute":2,"chartData":null,"RelativeValueText":"-0.83%","AbsoluteValueText":"-15.00","CurrentValueText":"1,790.85"},{"label":"Oil (WTI)","mobileHiddenLabel":null,"url":"/commodities/oil-price?type=wti","premarketObject":null,"valuePushApi":{"pushApiLibrary":"clientApiHandler","pushIdentifier":"Y01010080001594836-USD","pushDataField":"Last","pushRoomIdentifier":null,"template":null,"table":7,"time":null},"relativeValue":-0.56549,"absoluteValue":-0.43000,"currentValue":75.61000,"previousClose":75.98000,"roundedCurrent":2,"roundedAbsolute":2,"chartData":null,"RelativeValueText":"-0.57%","AbsoluteValueText":"-0.43","CurrentValueText":"75.61"},{"label":"BTC/USD","mobileHiddenLabel":null,"url":"/currencies/btc-usd","premarketObject":null,"valuePushApi":{"pushApiLibrary":"clientApiHandler","pushIdentifier":"Y0401000000F123456","pushDataField":"Mid","pushRoomIdentifier":null,"template":null,"table":7,"time":null},"relativeValue":-0.467863410711288,"absoluteValue":-222.75,"currentValue":47387.30078125,"previousClose":47610.05078125,"roundedCurrent":2,"roundedAbsolute":2,"chartData":null,"RelativeValueText":"-0.47%","AbsoluteValueText":"-222.75","CurrentValueText":"47,387.30"}]}
  });
</script>
<fieldset id="markets-now-section" class="markets-now-section">
  <legend class="markets-now-section__legend"><a href="/premarket">U.S. markets open in 32 minutes 3 seconds</a></legend>
  <div class="markets-now-section__row">
      <div class="markets-now-section__market">
        <div class="markets-now  markets-now--negative">
          <div class="markets-now__header">
            <div class="markets-now__up-or-down">
              <div class="arrow"></div>
            </div>
            <a href="#" class="markets-now__caption">Dow <span class="markets-now__sub-caption">Futures</span></a>
          </div>
          <div class="markets-now__values">
            <div class="markets-now__relative-value">-0.03%</div>
            <div class="markets-now__absolute-value">-10.00</div>
            <div class="markets-now__current-value">36,270.00</div>
          </div>
        </div>
      </div>
      <div class="markets-now-section__market">
        <div class="markets-now  markets-now--negative">
          <div class="markets-now__header">
            <div class="markets-now__up-or-down">
              <div class="arrow"></div>
            </div>
            <a href="#" class="markets-now__caption">S&amp;P <span class="markets-now__sub-caption">Futures</span></a>
          </div>
          <div class="markets-now__values">
            <div class="markets-now__relative-value">-0.09%</div>
            <div class="markets-now__absolute-value">-4.25</div>
            <div class="markets-now__current-value">4,776.75</div>
          </div>
        </div>
      </div>
      <div class="markets-now-section__market">
        <div class="markets-now  markets-now--negative">
          <div class="markets-now__header">
            <div class="markets-now__up-or-down">
              <div class="arrow"></div>
            </div>
            <a href="#" class="markets-now__caption">NASDAQ <span class="markets-now__sub-caption">Futures</span></a>
          </div>
          <div class="markets-now__values">
            <div class="markets-now__relative-value">-0.20%</div>
            <div class="markets-now__absolute-value">-33.00</div>
            <div class="markets-now__current-value">16,479.50</div>
          </div>
        </div>
      </div>
      <div class="markets-now-section__market">
        <div class="markets-now  markets-now--negative">
          <div class="markets-now__header">
            <div class="markets-now__up-or-down">
              <div class="arrow"></div>
            </div>
            <a href="#" class="markets-now__caption">Gold <span class="markets-now__sub-caption"></span></a>
          </div>
          <div class="markets-now__values">
            <div class="markets-now__relative-value">-0.83%</div>
            <div class="markets-now__absolute-value">-15.00</div>
            <div class="markets-now__current-value">1,790.85</div>
          </div>
        </div>
      </div>
      <div class="markets-now-section__market">
        <div class="markets-now  markets-now--negative">
          <div class="markets-now__header">
            <div class="markets-now__up-or-down">
              <div class="arrow"></div>
            </div>
            <a href="#" class="markets-now__caption">Oil (WTI) <span class="markets-now__sub-caption"></span></a>
          </div>
          <div class="markets-now__values">
            <div class="markets-now__relative-value">-0.57%</div>
            <div class="markets-now__absolute-value">-0.43</div>
            <div class="markets-now__current-value">75.61</div>
          </div>
        </div>
      </div>
      <div class="markets-now-section__market">
        <div class="markets-now  markets-now--negative">
          <div class="markets-now__header">
            <div class="markets-now__up-or-down">
              <div class="arrow"></div>
            </div>
            <a href="#" class="markets-now__caption">BTC/USD <span class="markets-now__sub-caption"></span></a>
          </div>
          <div class="markets-now__values">
            <div class="markets-now__relative-value">-0.47%</div>
            <div class="markets-now__absolute-value">-222.75</div>
            <div class="markets-now__current-value">47,387.30</div>
          </div>
        </div>
      </div>
  </div>
</fieldset>
		</div>
	</div>
</header>
<div class="site-header__breakpoint"></div>
<aside class="navigation-region side-panel-left" data-side-panel="navigation-region">
	<!-- Navigation Region Header -->
	<header class="navigation-region__header">
		<div class="navigation-region__search">
			<a href="/stocks/find-stocks" title="Stocks Advanced Search" class="button button--icon-only button--border-hidden button--hover-blue button--size-large">
				<span class="icon icon-search"></span>
			</a>
		</div>
		<div class="navigation-region__caption">
			<a href="https://www.insider.com/" class="logo logo-insider logo-insider--left-side-panel" title="Insider">Insider</a>
		</div>
		<div class="navigation-region__close-button">
			<button class="button button--icon-only button--border-hidden button--hover-blue button--size-large" data-side-panel-close="navigation-region">
				<span class="icon icon-close"></span>
			</button>
		</div>
	</header>

	<!-- Main Menu -->
	<div class="navigation-region__content">
		<div class="navigation-region__menu">
				<ul class="left-menu">
				<li class="left-menu__item ">
					<div class="left-menu__toggle-button button button--opener"></div>
					<div class="left-menu__text">
						<a href="/" class="left-menu__link" title="Markets">Markets</a>
					</div>
						<ul class="left-menu__submenu">
									<li class="left-menu__submenu__item"><a href="/bonds" class="left-menu__submenu__text">Bonds</a></li>
									<li class="left-menu__submenu__item"><a href="/funds" class="left-menu__submenu__text">Funds</a></li>
									<li class="left-menu__submenu__item"><a href="/premarket" class="left-menu__submenu__text">Pre-Market</a></li>
									<li class="left-menu__submenu__item"><a href="/index/market-movers" class="left-menu__submenu__text">Market Movers</a></li>
									<li class="left-menu__submenu__item"><a href="/index/dow_jones" class="left-menu__submenu__text">Dow Jones Live</a></li>
									<li class="left-menu__submenu__item"><a href="/mymarkets" class="left-menu__submenu__text">Your Portfolio</a></li>
						</ul>
				</li>
				<li class="left-menu__item ">
					<div class="left-menu__toggle-button button button--opener"></div>
					<div class="left-menu__text">
						<a href="/stocks" class="left-menu__link" title="Stocks">Stocks</a>
					</div>
						<ul class="left-menu__submenu">
									<li class="left-menu__submenu__item"><a href="/stocks/find-stocks" class="left-menu__submenu__text">Stocks Finder</a></li>
									<li class="left-menu__submenu__item"><a href="/index/market-movers" class="left-menu__submenu__text">Market Movers</a></li>
									<li class="left-menu__submenu__item"><a href="/index/components" class="left-menu__submenu__text">Index Constituents</a></li>
									<li class="left-menu__submenu__item"><a href="/earnings-calendar" class="left-menu__submenu__text">Earnings Calendar</a></li>
									<li class="left-menu__submenu__item"><a href="/stocks/dividends" class="left-menu__submenu__text">Dividends</a></li>
						</ul>
				</li>
				<li class="left-menu__item ">
					<div class="left-menu__toggle-button button button--opener"></div>
					<div class="left-menu__text">
						<a href="/indices" class="left-menu__link" title="Indices">Indices</a>
					</div>
						<ul class="left-menu__submenu">
									<li class="left-menu__submenu__item"><a href="/index/market-movers" class="left-menu__submenu__text">Market Movers</a></li>
									<li class="left-menu__submenu__item"><a href="/index/components" class="left-menu__submenu__text">Index Constituents</a></li>
									<li class="left-menu__submenu__item"><a href="/index/dow_jones" class="left-menu__submenu__text">Dow Jones Live</a></li>
									<li class="left-menu__submenu__item"><a href="/index/s&p_500" class="left-menu__submenu__text">S&P 500 Live</a></li>
									<li class="left-menu__submenu__item"><a href="/index/nasdaq_100" class="left-menu__submenu__text">NASDAQ Live</a></li>
									<li class="left-menu__submenu__item"><a href="/indices" class="left-menu__submenu__text">World Map</a></li>
						</ul>
				</li>
				<li class="left-menu__item ">
					<div class="left-menu__toggle-button button button--opener"></div>
					<div class="left-menu__text">
						<a href="/commodities" class="left-menu__link" title="Commodities">Commodities</a>
					</div>
						<ul class="left-menu__submenu">
									<li class="left-menu__submenu__item"><a href="/news/ressort/commodities" class="left-menu__submenu__text">News</a></li>
									<li class="left-menu__submenu__item"><a href="/commodities/realtime-list" class="left-menu__submenu__text">Commodities Live</a></li>
									<li class="left-menu__submenu__item"><a href="/commodities/gold-price" class="left-menu__submenu__text">Gold</a></li>
									<li class="left-menu__submenu__item"><a href="/commodities/oil-price?type=wti" class="left-menu__submenu__text">Oil</a></li>
									<li class="left-menu__submenu__item"><a href="/commodities/copper-price" class="left-menu__submenu__text">Copper</a></li>
						</ul>
				</li>
				<li class="left-menu__item ">
					<div class="left-menu__toggle-button button button--opener"></div>
					<div class="left-menu__text">
						<a href="/cryptocurrencies" class="left-menu__link" title="Cryptocurrencies">Cryptocurrencies</a>
					</div>
						<ul class="left-menu__submenu">
									<li class="left-menu__submenu__item"><a href="/currencies/btc-usd" class="left-menu__submenu__text">Bitcoin</a></li>
									<li class="left-menu__submenu__item"><a href="/currencies/eth-usd" class="left-menu__submenu__text">Ethereum</a></li>
									<li class="left-menu__submenu__item"><a href="/cryptocurrencies" class="left-menu__submenu__text">Cryptocurrencies Live</a></li>
						</ul>
				</li>
				<li class="left-menu__item ">
					<div class="left-menu__toggle-button button button--opener"></div>
					<div class="left-menu__text">
						<a href="/currencies" class="left-menu__link" title="Currencies">Currencies</a>
					</div>
						<ul class="left-menu__submenu">
									<li class="left-menu__submenu__item"><a href="/news/ressort/currencies" class="left-menu__submenu__text">News</a></li>
									<li class="left-menu__submenu__item"><a href="/currencies/realtime-list" class="left-menu__submenu__text">Currencies Live</a></li>
									<li class="left-menu__submenu__item"><a href="/currency-converter" class="left-menu__submenu__text">Currency Converter</a></li>
									<li class="left-menu__submenu__item"><a href="/currencies/eur-usd" class="left-menu__submenu__text">EUR/USD</a></li>
									<li class="left-menu__submenu__item"><a href="/currencies/gbp-usd" class="left-menu__submenu__text">GBP/USD</a></li>
									<li class="left-menu__submenu__item"><a href="/index/us-dollar-index" class="left-menu__submenu__text">US Dollar Index</a></li>
						</ul>
				</li>
				<li class="left-menu__item ">
					<div class="left-menu__toggle-button button button--opener"></div>
					<div class="left-menu__text">
						<a href="/etfs" class="left-menu__link" title="ETFs">ETFs</a>
					</div>
						<ul class="left-menu__submenu">
									<li class="left-menu__submenu__item"><a href="/news/ressort/etf" class="left-menu__submenu__text">News</a></li>
									<li class="left-menu__submenu__item"><a href="/etf/finder" class="left-menu__submenu__text">ETF Finder</a></li>
									<li class="left-menu__submenu__item"><a href="/etf/investmentcompanies" class="left-menu__submenu__text">ETF Issuers</a></li>
						</ul>
				</li>
				<li class="left-menu__item left-menu__item--no-submenu">
					<div class="left-menu__toggle-button button button--opener"></div>
					<div class="left-menu__text">
						<a href="/news" class="left-menu__link" title="News">News</a>
					</div>
				</li>
	</ul>


		</div>
		<div class="navigation-region__actions">
			<a href="#" class="button button--icon-only button--border-hidden margin-right--medium" data-side-panel-open="login" data-side-panel-close="navigation-region">
				<span class="icon icon-user"></span>
			</a>
			<a href="https://www.businessinsider.com/subscription/prime?utm_source=markets" class="button button--pill button--size-small" target="_blank" title="Subscribe">Subscribe</a>
		</div>
		<div class="navigation-region__social-links">
			<a href="http://www.twitter.com/mktsinsider" target="_blank" class="button button--icon-only button--border-blue"><span class="icon icon-social-media-twitter"></span></a>
			<a href="https://www.facebook.com/BusinessInsider.Finance" target="_blank" class="button button--icon-only button--border-blue margin-left--medium"><span class="icon icon-social-media-facebook"></span></a>
			<a href="https://www.linkedin.com/company/insiderdigital" target="_blank" class="button button--icon-only button--border-blue margin-left--medium"><span class="icon icon-social-media-linkedin"></span></a>
			<a href="https://www.youtube.com/thisisinsider" target="_blank" class="button button--icon-only button--border-blue margin-left--medium"><span class="icon icon-social-media-youtube"></span></a>
			<a href="https://www.instagram.com/insider" target="_blank" class="button button--icon-only button--border-blue margin-left--medium"><span class="icon icon-social-media-instagram"></span></a>
		</div>
	</div>

    <!-- Rights Infos & Disclaimer -->
    <footer class="navigation-region__footer">
        <p class="navigation-region__footer__text">
            &copy; 2021 Insider Inc. and <a href="https://www.finanzen.net/impressum" class="navigation-region__footer__link">finanzen.net</a> GmbH (Imprint). All rights reserved.
        </p>
        <p class="navigation-region__footer__text">
            Registration on or use of this site constitutes acceptance of our <a href="http://www.businessinsider.com/terms" class="navigation-region__footer__link">Terms of Service</a> and <a href="https://www.insider-inc.com/privacy-policy#ccpa" class="navigation-region__footer__link">Privacy Policy</a>.
        </p>
        <p class="navigation-region__footer__text">
	        <a href="http://www.businessinsider.com/terms" class="navigation-region__footer__link" rel="sponsored">Disclaimer</a> |
	        <a href="https://www.insider-inc.com/accessibility" class="navigation-region__footer__link" rel="sponsored">Accessibility Statement</a> |
            <a href="http://www.businessinsider.com/commerce-on-business-insider" class="navigation-region__footer__link" rel="sponsored">Commerce Policy</a> |
            <a href="http://nytm.org/made" class="navigation-region__footer__link" rel="sponsored">Made In NYC</a> |
            Stock quotes by <a href="https://www.finanzen.net/" class="navigation-region__footer__link">finanzen.net</a>
        </p>
    </footer>
</aside>


<aside class="user-region side-panel-right" data-side-panel="login">
	<!-- Left Side Panel Header -->
	<header class="user-region__header">
		<div class="user-region__close-button">
			<button class="button button--icon-only button--border-hidden button--hover-blue button--size-large" data-side-panel-close="login">
				<span class="icon icon-close"></span>
			</button>
		</div>
		<div class="user-region__caption">
			<a href="#" class="logo logo-markets-insider logo--size-auto" title="Insider">Insider</a>
		</div>
	</header>

	<!-- Main Menu -->
	<div class="user-region__content">
		<div class="user-region__greeting">
			<h3 class="spacer-zero">Login to your account</h3>
		</div>
		<div class="user-region__actions">
				<a class="button button--rounded button--stretch button--size-large margin-bottom--medium" href="/mymarkets?originurl=%2fstocks%2fmmm-stock">Signup</a>
				<a class="button button--rounded button--stretch button--size-large margin-bottom--medium" href="/mymarkets?originurl=%2fstocks%2fmmm-stock">Login</a>
				<a class="button button--pill button--rounded button--stretch button--size-large margin-bottom--medium" href="https://www.businessinsider.com/subscription/prime?utm_source=markets">Subscribe to BI Prime</a>
		</div>
	</div>
</aside>

	</div>

	<!-- Markets Insider Page Content -->
	<main class="site-content">





<div >
				<div class="site-content__row ">
<div  class="grid__col--12 grid__col--m-12 grid__col--s-12  site-content__col--spacer">
		<div class="htlad-subnav"
				 data-htlad="true"
				 data-unit="Markets-Insider/Stocks/Quote"
				 data-prebid="0x0:|768x0:Stocks/Quote/billboard_flex|1024x0:Stocks/Quote/billboard_flex"></div>
</div>
				</div>
					<div class="spacer-10"></div>
				<div class="site-content__row graviton">
<div class="site-content__col site-content__col--left">
<script>
	window.priceSections = window.priceSections || {};
	window.priceSections.configs = window.priceSections.configs || [];
	window.priceSections.configs.push({
		watchListId: '#watch-list-daacbf2e4c2e48d99dbb5f5b493b4da1',
		regionSelector: '#price-section-daacbf2e4c2e48d99dbb5f5b493b4da1',
		priceSection: {"label":"3M Co.","symbol":"MMM","instrumentId":402,"exchangeLabel":null,"currency":"","category":"Stock","tradingButton":null,"relativeValue":0.0056296796712215873,"absoluteValue":0.0099999999999909051,"currentValue":177.64,"previousClose":177.63,"roundedCurrent":2,"roundedAbsolute":2,"roundedRelative":2,"valuePushApi":{"pushApiLibrary":"clientApiHandler","pushIdentifier":"Y010149B0001405105","pushDataField":"Last","pushRoomIdentifier":"RY010149B0001405105","template":"Last","table":7,"time":null},"timePushApi":{"pushApiLibrary":"clientApiHandler","pushIdentifier":"Y010149B0001405105","pushDataField":"LastTimestamp","pushRoomIdentifier":"RY010149B0001405105","template":"LastTimestamp","table":1,"time":"08:03:16 AM"},"plus500TradingLink":"https://www.plus500.com/Trading/Stocks?id=127452&tags=marketsinsider_stocksdetail_buysell&pl=2","preTimePushText":"Pre-market ","postTimePushText":"NYSE","timePushText":null,"time":"08:03:16 AM","isFuture":false}
	});

	// TODO (at)if (Model.Future != null) not working, why?
	window.priceSections.configs.push({
		regionSelector: '#price-section-with-future-daacbf2e4c2e48d99dbb5f5b493b4da1',
		priceSection: {"label":"","symbol":"","instrumentId":402,"exchangeLabel":null,"currency":"","category":"","tradingButton":null,"relativeValue":0.53197509903791618,"absoluteValue":0.93999999999999773,"currentValue":177.64,"previousClose":176.7,"roundedCurrent":2,"roundedAbsolute":2,"roundedRelative":2,"valuePushApi":{"pushApiLibrary":"clientApiHandler","pushIdentifier":"Y01010410001405105","pushDataField":"Mid","pushRoomIdentifier":"RY01010410001405105","template":"Mid","table":7,"time":null},"timePushApi":{"pushApiLibrary":"clientApiHandler","pushIdentifier":"Y01010410001405105","pushDataField":"MidTimestamp","pushRoomIdentifier":"RY01010410001405105","template":"MidTimestamp","table":1,"time":"Official Close 12/28/2021"},"plus500TradingLink":null,"preTimePushText":null,"postTimePushText":"NYSE","timePushText":null,"time":"Official Close 12/28/2021","isFuture":true}
	});

	window.addInstrumentConfigs = window.addInstrumentConfigs || [];
	window.addInstrumentConfigs.push({
		config: {
			sidePanelName: 'addInstrument',
			loginUrl: '/mymarkets?r=%2fstocks%2fmmm-stock',
			watchlistUrl: '/mymarkets/watchlist'
		},
    regionId: 'daacbf2e4c2e48d99dbb5f5b493b4da1'
});
</script>

<div class="graviton">
	<div class="price-section-with-button">
		<div class="price-section-with-button__row">
			<div class="price-section-with-button__price-section-col ">
				<section id="price-section-daacbf2e4c2e48d99dbb5f5b493b4da1" class="price-section">
					<div class="price-section__row">
						<h1 class="price-section__identifiers">
							<span class="price-section__label">3M Co. </span>
							<span class="price-section__category">
								Stock <span>, MMM</span>							</span>

						</h1>
						<div class="price-section__values">
							<span class="price-section__current-value">177.64</span>
							<span class="price-section__breakpoint"></span>
							<span class="price-section__absolute-value">
								+0.01
							</span>
							<span class="price-section__relative-value">
								+0.01%
							</span>
						</div>
						<div class="price-section__additionals">
							<span>Pre-market </span>
							<span>08:03:16 AM</span>
							<span class="padding-left--smaller">NYSE</span>
						</div>
					</div>
				</section>
			</div>
			<div class="price-section-with-button__price-section-button-col">
				<div class="price-section-with-button__button-grid grid">
					<div class="price-section-with-button__container">
            <button class="price-section-with-button__plus500 hidden price-section-with-button__fixed-width button--color-blue" title="Plus500. 72% of retail CFD accounts lose money" data-plus-500>Start Trading</button>
            <div class="price-section-with-button__button-row price-section-with-button__buttons">
              <button class="button price-section-with-button__fixed-width" data-add-instrument="daacbf2e4c2e48d99dbb5f5b493b4da1" data-add-instrument-label="3M Co." data-add-instrument-type="2" data-add-instrument-id="402" data-add-instrument-isin="US88579Y1010">Add to watchlist</button>
              <div class="margin-top--xsmall price-section-with-button__fixed-width">

		<div class="htlad-button"
				 data-htlad="true"
				 data-unit="Markets-Insider/Stocks/Quote"></div>

              </div>
            </div>
					</div>
					<div class="price-section-with-button__button-row price-section-with-button__description note plus-500-description">
						<span class="hidden grid--d-none grid--d-s-block" data-plus-500>Plus500. 72% of retail CFD accounts lose money</span>
					</div>
				</div>
			</div>
				<div class="price-section-with-button__price-section-future-col ">
					<section id="price-section-with-future-daacbf2e4c2e48d99dbb5f5b493b4da1" class="price-section price-section--future">
						<div class="price-section__row">
							<div class="price-section__values">
								<span class="price-section__current-value">177.64</span>
								<span class="price-section__breakpoint"></span>
								<span class="price-section__absolute-value">
									+0.94
								</span>
								<span class="price-section__relative-value">
									+0.53%
								</span>
							</div>
							<div class="price-section__additionals">
								<span></span>
								<span>Official Close 12/28/2021</span>
								<span>NYSE</span>
							</div>
						</div>
					</section>
				</div>
		</div>
	</div>
</div>

</div>
				</div>
				<div class="site-content__row graviton">
<div class="site-content__col site-content__col--left"><style>
    .left-rail-blackLine {
        height: 24px;
        border-bottom: 1px solid #111111;
    }
</style>
<div class="graviton">
    <div class="horizontal-line"></div>
</div>
<div id='lgPositionDetailChart'></div><div class='responsivePosition' id='DetailChart'>


<style>
    .stx_mountain_chart {
        background: #01498a !important;
        color: #01498a !important;
        border: #01498a !important;
        border-width: 1px;
    }
</style>



<script>
	var detailChartViewmodel = { "ChartSource" : "65", "ChartValor" : "1405105", "ChartExchange" : "65", "ChartCurrency" : "333", "TKData" : "65,1405105,65,333", "ChartData" : null, "intradayTkData" : "65,1405105,899,333", "InstrumentID" : 402, "InstrumentTypeID" : 3, "InstrumentType" : "Share", "StockMarkets" : { "NDN" : "NDN", "NYSE MKT" : "AMEX", "BAE" : "Baader Bank", "BER" : "Berlin", "BMN" : "BMN", "BRX" : "BX Swiss", "BTT" : "BATS Trading", "BUL" : "Bulgarian SE", "DUS" : "D端sseldorf", "FSE" : "Frankfurt", "GVIE" : "GVIE", "HAM" : "Hamburg", "HAN" : "Hannover", "MIC" : "MICEX", "MUN" : "M端nchen", "MXK" : "Mexiko", "XETRA" : "XUS", "NYSE" : "New York", "STU" : "Stuttgart", "SWX" : "Swiss Exchange", "TGT" : "Tradegate", "XQTX" : "XQTX" }, "Tabs" : [{ "Name" : "IntradayAvailability", "ShortName" : "Intraday" }, { "Name" : "OneWeek", "ShortName" : "1W" }, { "Name" : "OneMonth", "ShortName" : "1M" }, { "Name" : "ThreeMonths", "ShortName" : "3M" }, { "Name" : "SixMonths", "ShortName" : "6M" }, { "Name" : "YTD", "ShortName" : "YTD" }, { "Name" : "OneYear", "ShortName" : "1Y" }, { "Name" : "ThreeYears", "ShortName" : "3Y" }, { "Name" : "FiveYears", "ShortName" : "5Y" }, { "Name" : "TenYears", "ShortName" : "10Y" }, { "Name" : "Maximum", "ShortName" : "MAX" }], "PushIdentifier" : "Y01010410001405105", "PushDataField" : null, "StockUrl" : "/stocks/mmm/price", "Currency" : "USD", "StockMarketsExchanges" : [{ "TKData" : "65,1405105,1179,333", "ExchangeName" : "NYSE Bsc", "ExchangeNameShort" : "NDN" }, { "TKData" : "65,1405105,3319,333", "ExchangeName" : "Baader Bank", "ExchangeNameShort" : "BAE" }, { "TKData" : "65,1405105,18,333", "ExchangeName" : "Berlin-Bremen", "ExchangeNameShort" : "BER" }, { "TKData" : "65,1405105,1174,333", "ExchangeName" : "BX Swiss", "ExchangeNameShort" : "BRX" }, { "TKData" : "65,1405105,899,333", "ExchangeName" : "BATS Trading", "ExchangeNameShort" : "BTT" }, { "TKData" : "65,1405105,308,333", "ExchangeName" : "BUL", "ExchangeNameShort" : "BUL" }, { "TKData" : "65,1405105,14,333", "ExchangeName" : "D端sseldorf", "ExchangeNameShort" : "DUS" }, { "TKData" : "65,1405105,13,333", "ExchangeName" : "Frankfurt", "ExchangeNameShort" : "FSE" }, { "TKData" : "65,1405105,1523,333", "ExchangeName" : "Vienna EX 3", "ExchangeNameShort" : "GVIE" }, { "TKData" : "65,1405105,17,333", "ExchangeName" : "Hamburg", "ExchangeNameShort" : "HAM" }, { "TKData" : "65,1405105,19,333", "ExchangeName" : "Hannover", "ExchangeNameShort" : "HAN" }, { "TKData" : "65,1405105,549,333", "ExchangeName" : "MICEX", "ExchangeNameShort" : "MIC" }, { "TKData" : "65,1405105,15,333", "ExchangeName" : "M端nchen", "ExchangeNameShort" : "MUN" }, { "TKData" : "65,1405105,80,333", "ExchangeName" : "MXK", "ExchangeNameShort" : "MXK" }, { "TKData" : "65,1405105,44,333", "ExchangeName" : "XETRA", "ExchangeNameShort" : "XETRA" }, { "TKData" : "65,1405105,65,333", "ExchangeName" : "New York", "ExchangeNameShort" : "NYSE" }, { "TKData" : "65,1405105,16,333", "ExchangeName" : "Stuttgart", "ExchangeNameShort" : "STU" }, { "TKData" : "65,1405105,4,333", "ExchangeName" : "SIX SX", "ExchangeNameShort" : "SWX" }, { "TKData" : "65,1405105,6829,333", "ExchangeName" : "QUOTRIXDDORF", "ExchangeNameShort" : "XQTX" }], "InstrumentName" : "mmm-stock", "isOutOfMarketTime" : true, "isAmericanStock" : true, "isAsiaStock" : false, "intradayUrl" : "instruments=65,1405105,899,333&style=instrument_intraday_novolume&period=IntradayAvailability&timezone=Eastern Standard Time", "PreviousClose" : "176.70000", "AllwaysManipulatePreviuosClose" : false, "TabIdentifier" : null, "ChartNumber" : 0, "ActiveTab" : "OneYear", "HasIntradyData" : false, "Usedecimal" : false };
	var utcOffset = -5;
</script>


<style>
	.stx_mountain_chart {
		background-color: rgb(1,73,138, 0.8);
		color: rgb(1,73,138, 0.8);
		border: rgb(1, 73, 138, 0.8);
		border-width: 1px;
	}

	.stx_current_hr_up {
		background-color: #18bb5c;
	}

	.stx_current_hr_down {
		background-color: #ff433d;
	}

	.chartSize { /* Chart size container */
		display: none;
	}

	.stx_crosshair {
		background-color: #b5b5bc;
	}

	.stx-panel-title {
		display: none;
	}

	.stx_volume_underlay_up {
		color: rgb(24, 187, 92);
		opacity: .5;
		border-left-color: transparent;
	}

	.stx_volume_underlay_down {
		color: rgb(255, 67, 61);
		opacity: .5;
		border-left-color: transparent;
	}

	.stx_colored_mountain_chart {
		background-color: rgb(1,73,138, 0.8);
		color: rgb(1,73,138, 0.8);
		border: rgb(1, 73, 138, 0.8);
		padding: 2px;
		border-width: 2px;
	}

	.stx_line_up {
		color: rgb(24, 187, 92);
	}

	.stx_line_down {
		color: rgb(255, 67, 61);
	}

	.stx-btn-panel > span.stx-ico-focus {
		display: none
	}
</style>
	<link rel="stylesheet" href="/Content/Chart/finando-chartengine/styles.css">
	<app-root data-detail-chart></app-root>
									<div class="spacer-50 mobile-spacer-25"></div>
</div>
		<div class="htlad-mobile_in_post_ad_1"
				 data-htlad="true"
				 data-unit="Markets-Insider/Stocks/Quote"
				 data-prebid="0x0:Stocks/Quote/medrec_flex|768x0:"></div>
<div id="xsPositionsnapshot"></div>
		<div class="htlad-desktop_in_post_ad_1"
				 data-htlad="true"
				 data-unit="Markets-Insider/Stocks/Quote"
				 data-prebid="0x0:|768x0:Stocks/Quote/medrec|1261x0:Stocks/Quote/billboard_flex"></div>
	<div class="graviton">
			<h2 id="commodity-news" class="header-underline">
				News
					<a href="/news/mmm-stock" class="header-underline__right-text">More News<span class="icon icon-arrow-right"></span></a>
			</h2>

		<section class="instrument-stories">
				<div class="instrument-stories__story instrument-stories__story--no-image">
					<div class="instrument-stories__meta">
						<span class="instrument-stories__source">Zacks</span>
						<time class="instrument-stories__date" datetime="2021-12-28 23:50">15h</time>
					</div>
					<h3 class="instrument-stories__title">
						<a class="instrument-stories__link" href="/news/stocks/3m-mmm-gains-as-market-dips--what-you-should-know-10880448" >3M (MMM) Gains As Market Dips: What You Should Know</a>
					</h3>
					<p class="instrument-stories__teaser">
						<a class="instrument-stories__link" href="/news/stocks/3m-mmm-gains-as-market-dips--what-you-should-know-10880448" ></a>
					</p>
					<div class="instrument-stories__clear"></div>
				</div>
				<div class="instrument-stories__story instrument-stories__story--no-image">
					<div class="instrument-stories__meta">
						<span class="instrument-stories__source">Seeking Alpha</span>
						<time class="instrument-stories__date" datetime="2021-12-28 11:57">1d</time>
					</div>
					<h3 class="instrument-stories__title">
						<a class="instrument-stories__link" href="https://seekingalpha.com/news/3783465-market-positioning-is-too-bearish-jp-morgan-says?utm_source=markets.businessinsider.com&amp;utm_medium=referral" target=_blank rel=sponsored>Market positioning is too bearish, J.P. Morgan says: At the Open</a>
					</h3>
					<p class="instrument-stories__teaser">
						<a class="instrument-stories__link" href="https://seekingalpha.com/news/3783465-market-positioning-is-too-bearish-jp-morgan-says?utm_source=markets.businessinsider.com&amp;utm_medium=referral" target=_blank rel=sponsored></a>
					</p>
					<div class="instrument-stories__clear"></div>
				</div>
				<div class="instrument-stories__story instrument-stories__story--no-image">
					<div class="instrument-stories__meta">
						<span class="instrument-stories__source">Business Times</span>
						<time class="instrument-stories__date" datetime="2021-12-27 09:04">2d</time>
					</div>
					<h3 class="instrument-stories__title">
						<a class="instrument-stories__link" href="/news/stocks/camsing-healthcare-to-receive-s$11-3m-investment-to-boost-natures-farm-business-10877021" >Camsing Healthcare to receive S$11.3m investment to boost Nature's Farm business</a>
					</h3>
					<p class="instrument-stories__teaser">
						<a class="instrument-stories__link" href="/news/stocks/camsing-healthcare-to-receive-s$11-3m-investment-to-boost-natures-farm-business-10877021" ></a>
					</p>
					<div class="instrument-stories__clear"></div>
				</div>
				<div class="instrument-stories__story instrument-stories__story--no-image">
					<div class="instrument-stories__meta">
						<span class="instrument-stories__source">NewsBTC</span>
						<time class="instrument-stories__date" datetime="2021-12-23 13:00">6d</time>
					</div>
					<h3 class="instrument-stories__title">
						<a class="instrument-stories__link" href="/news/stocks/port-finance-raises-a-$5-3m-strategic-round-to-offer-fixed-rate-lending-on-solana-10872329" >Port Finance Raises a $5.3m Strategic Round To Offer Fixed Rate Lending on Solana</a>
					</h3>
					<p class="instrument-stories__teaser">
						<a class="instrument-stories__link" href="/news/stocks/port-finance-raises-a-$5-3m-strategic-round-to-offer-fixed-rate-lending-on-solana-10872329" ></a>
					</p>
					<div class="instrument-stories__clear"></div>
				</div>
				<div class="instrument-stories__story instrument-stories__story--no-image">
					<div class="instrument-stories__meta">
						<span class="instrument-stories__source">Cointelegraph</span>
						<time class="instrument-stories__date" datetime="2021-12-22 22:06">7d</time>
					</div>
					<h3 class="instrument-stories__title">
						<a class="instrument-stories__link" href="/news/stocks/hong-kong-nft-project-monkey-kingdom-loses-$1-3m-in-phishing-hack--launches-compensation-fund-10870694" >Hong Kong NFT project Monkey Kingdom loses $1.3M in phishing hack, launches compensation fund</a>
					</h3>
					<p class="instrument-stories__teaser">
						<a class="instrument-stories__link" href="/news/stocks/hong-kong-nft-project-monkey-kingdom-loses-$1-3m-in-phishing-hack--launches-compensation-fund-10870694" ></a>
					</p>
					<div class="instrument-stories__clear"></div>
				</div>
			<div class="instrument-stories__border"></div>
		</section>
	</div>
									<div class="spacer-50 mobile-spacer-25"></div>

		<div class="htlad-mobile_in_post_ad_1"
				 data-htlad="true"
				 data-unit="Markets-Insider/Stocks/Quote"
				 data-prebid="0x0:Stocks/Quote/medrec_flex|768x0:"></div>

		<div class="htlad-desktop_in_post_ad_1"
				 data-htlad="true"
				 data-unit="Markets-Insider/Stocks/Quote"
				 data-prebid="0x0:|768x0:Stocks/Quote/medrec|1261x0:Stocks/Quote/billboard_flex"></div>
<script>
    window.historicalPrices = window.historicalPrices || {};
    window.historicalPrices.configs = window.historicalPrices.configs || [];
    window.historicalPrices.configs.push({
        regionSelector: '#historicPrices',
        historicalPrices: {"instrumentName":"3M Co.","startDate":"Nov. 29 2021","endDate":"Dec. 29 2021","currentStockMarket":"NDN","instrumentIdentifier":"1405105","instrumentTypeName":"Valor","headerCells":["Date","Open","Close","Daily High","Daily Low","Volume"],"columns":["Date","Open","Close","High","Low","Volume"],"model":[{"Open":177.05500,"Close":177.63000,"High":178.48990,"Low":176.75000,"Volume":"","Date":"12/28/21"},{"Open":175.15000,"Close":176.77000,"High":176.77000,"Low":174.91000,"Volume":"","Date":"12/27/21"},{"Open":173.01000,"Close":174.93000,"High":175.62000,"Low":172.80000,"Volume":"","Date":"12/23/21"},{"Open":172.96000,"Close":172.57000,"High":173.23000,"Low":171.56000,"Volume":"","Date":"12/22/21"},{"Open":173.45000,"Close":172.94000,"High":173.99000,"Low":172.22000,"Volume":"","Date":"12/21/21"},{"Open":173.69000,"Close":172.52000,"High":173.87680,"Low":170.96500,"Volume":"","Date":"12/20/21"},{"Open":178.30000,"Close":174.80000,"High":178.30000,"Low":174.35000,"Volume":"","Date":"12/17/21"},{"Open":175.63000,"Close":178.30000,"High":178.94000,"Low":174.81500,"Volume":"","Date":"12/16/21"},{"Open":175.34000,"Close":175.72000,"High":176.22000,"Low":173.88000,"Volume":"","Date":"12/15/21"},{"Open":175.29000,"Close":174.79000,"High":176.60000,"Low":174.25000,"Volume":"","Date":"12/14/21"},{"Open":177.09000,"Close":174.65000,"High":177.36810,"Low":174.41000,"Volume":"","Date":"12/13/21"},{"Open":178.64000,"Close":177.10000,"High":178.64000,"Low":176.12310,"Volume":"","Date":"12/10/21"},{"Open":176.11000,"Close":175.90000,"High":177.39090,"Low":175.64200,"Volume":"","Date":"12/09/21"},{"Open":176.25000,"Close":176.00000,"High":176.82000,"Low":174.43000,"Volume":"","Date":"12/08/21"},{"Open":177.30000,"Close":176.57000,"High":178.34000,"Low":176.18000,"Volume":"","Date":"12/07/21"},{"Open":174.21000,"Close":177.22000,"High":178.28000,"Low":174.00000,"Volume":"","Date":"12/06/21"},{"Open":170.15000,"Close":172.65000,"High":172.91000,"Low":169.27500,"Volume":"","Date":"12/03/21"},{"Open":171.19500,"Close":170.23000,"High":172.78000,"Low":169.91000,"Volume":"","Date":"12/02/21"},{"Open":172.39000,"Close":170.74000,"High":174.65000,"Low":170.70000,"Volume":"","Date":"12/01/21"},{"Open":174.97000,"Close":170.08500,"High":175.71000,"Low":169.95000,"Volume":"","Date":"11/30/21"},{"Open":176.79000,"Close":176.18500,"High":176.82990,"Low":174.98000,"Volume":"","Date":"11/29/21"}],"instrumentId":402}
    });
</script>

<div class="graviton">
		<h2 class="header-underline">Historical Prices</h2>

	<div id="historicPrices">
		<div class="grid__row">
			<div class="grid__col--6 grid__col--m-12 grid__col--s-12 grid--d-flex grid--justify-content-start grid--order-1 grid--order-s-3">
				<button class="button button--with-icon margin-right--s" title="Feb. 04 2021">
					<span class="icon icon-calendar"></span>
					<span class="button__label">Feb. 04 2021</span>
					<span class="icon icon-left_right"></span>
				</button>
				<button class="button button--with-icon" title="Mar. 05 2021">
					<span class="icon icon-calendar"></span>
					<span class="button__label">Mar. 05 2021</span>
					<span class="icon icon-left_right"></span>
				</button>
			</div>
			<div class="grid__col--6 grid__col--m-12 grid__col--s-12 grid--d-flex grid--justify-content-end grid--justify-content-m-start grid--justify-content-s-start grid--order-2 grid--order-s-1">
				<button class="button margin-right--s" title="Download">
					<span class="button__label">Download</span>
				</button>
				<button title="Reset" class="button ">
					<span class="button__label">Reset</span>
				</button>
			</div>
			<div class="grid__col--12 grid--order-3 grid--order-s-2">
				<table class="table table--fixed table--sortable">
					<caption>Loading..</caption>
					<thead class="table__thead">
						<tr class="table__tr">
							<th class="table__th">Date</th>
							<th class="table__th">Open</th>
							<th class="table__th">Close</th>
							<th class="table__th">Daily High</th>
							<th class="table__th">Daily Low</th>
						</tr>
					</thead>
				</table>
			</div>
			<div class="historical-prices__price-change grid__col--12 grid--order-4 grid--order-s-4">
				<span>Price change over selected period:</span>
				<span class="historical-prices__price-change-values">
					<span class="font-color-gray">0%</span>
					<span class="margin-left--s">0</span>
				</span>
			</div>
		</div>
	</div>
</div>									<div class="spacer-50 mobile-spacer-25"></div>

<div class="graviton">
  <h2 class="header-underline">Analyst Data</h2>
  <div class="analysis-chart" id="analysis-chart-xcsdf4234">
    <!-- Analysts -->
    <div class="analysis-chart__analysts">
      <span class="analysis-chart__label">
        Total Analysts: <span class="analysis-chart__value">43</span>
      </span>
    </div>
    <!-- Ratings -->
    <div class="analysis-chart__ratings">
      <span class="analysis-chart__label">
        Buy Ratings: <span class="analysis-chart__value">8</span>
      </span>
      <span class="analysis-chart__label">
        Neutral Ratings: <span class="analysis-chart__value">27</span>
      </span>
      <span class="analysis-chart__label">
        Sell Ratings: <span class="analysis-chart__value">8</span>
      </span>
    </div>
    <!-- Chart -->
    <div class="analysis-chart__chart"></div>
    <!-- Dot & Tooltip Template -->
    <div id="analysis-chart-xcsdf4234-tooltip" class="analysis-chart__dot" data-analysis-chart="marker">
      <span class="analysis-chart__tooltip" id="analysis-chart-xcsdf4234-tooltip-labels">
        <span class="analysis-chart__tooltip-label"><span class="font-weight-bold">Analyst:</span> {{ANALYST_DATA}}</span><br />
        <span class="analysis-chart__tooltip-label"><span class="font-weight-bold">Price-Target:</span> {{PRICE_DATA}}</span><br />
        <span class="analysis-chart__tooltip-label"><span class="font-weight-bold">Rating:</span> {{RATING_DATA}}</span>
      </span>
    </div>
    <!-- Legend -->
    <div class="analysis-chart__legend">
      <span class="analysis-chart__legend-item">Price</span>
      <span class="analysis-chart__legend-item analysis-chart__legend-item--blue">*Price Target</span>
    </div>
    <!-- Bottom Values -->
    <div class="analysis-chart__bottom-values">
      <span class="analysis-chart__label">
        Lowest: <span class="analysis-chart__value">146.00</span>
      </span>
      <span class="analysis-chart__label">
        Median: <span class="analysis-chart__value">183.70</span>
      </span>
      <span class="analysis-chart__label">
        Highest: <span class="analysis-chart__value">215.00</span>
      </span>
    </div>
    <!-- Comment -->
    <div class="analysis-chart__comment">
      *The average price target includes all analyst analysis, not just the most recent analysis presented in the chart.
    </div>
  </div>
</div>
<script>
window.analyseChartConfigs = window.analyseChartConfigs || [];
window.analyseChartConfigs.push({
    config: {"InstrumentName":null,"NumberOfAnalysis":43,"NumberOfBuy":8,"NumberOfNeutral":27,"NumberOfSell":8,"LowestPriceTarget":146.0,"HighestPriceTarget":215.0,"MedianPriceTarget":183.69767441860466,"AllPriceTargetAmount":7899.0,"Model":[{"Close":196.95,"Open":0.0,"High":0.0,"Low":0.0,"Volume":0.0,"Estimate":212.0,"Date":"20210706"},{"Close":199.83,"Open":0.0,"High":0.0,"Low":0.0,"Volume":0.0,"Estimate":215.0,"Date":"20210712"},{"Close":202.98,"Open":0.0,"High":0.0,"Low":0.0,"Volume":0.0,"Estimate":196.0,"Date":"20210714"},{"Close":198.31,"Open":0.0,"High":0.0,"Low":0.0,"Volume":0.0,"Estimate":207.0,"Date":"20210728"},{"Close":181.38,"Open":0.0,"High":0.0,"Low":0.0,"Volume":0.0,"Estimate":172.0,"Date":"20210917"},{"Close":176.2,"Open":0.0,"High":0.0,"Low":0.0,"Volume":0.0,"Estimate":196.0,"Date":"20211004"},{"Close":177.81,"Open":0.0,"High":0.0,"Low":0.0,"Volume":0.0,"Estimate":193.0,"Date":"20211007"},{"Close":176.81,"Open":0.0,"High":0.0,"Low":0.0,"Volume":0.0,"Estimate":179.0,"Date":"20211008"},{"Close":178.21,"Open":0.0,"High":0.0,"Low":0.0,"Volume":0.0,"Estimate":197.5,"Date":"20211027"},{"Close":172.65,"Open":0.0,"High":0.0,"Low":0.0,"Volume":0.0,"Estimate":199.0,"Date":"20211203"},{"Close":177.1,"Open":0.0,"High":0.0,"Low":0.0,"Volume":0.0,"Estimate":182.0,"Date":"20211210"},{"Close":175.72,"Open":0.0,"High":0.0,"Low":0.0,"Volume":0.0,"Estimate":198.0,"Date":"20211215"},{"Close":174.8,"Open":0.0,"High":0.0,"Low":0.0,"Volume":0.0,"Estimate":180.0,"Date":"20211217"}],"Markers":[{"PriceTarget":156.0,"InternalRating":"neutral","Date":1584465840000.0,"DateLabel":"03/17/2020","Company":"Morgan Stanley","RealDate":"2020-03-17T17:24:00+01:00"},{"PriceTarget":159.0,"InternalRating":"neutral","Date":1585347802000.0,"DateLabel":"03/27/2020","Company":"Goldman Sachs","RealDate":"2020-03-27T22:23:22+01:00"},{"PriceTarget":146.0,"InternalRating":"neutral","Date":1585779802000.0,"DateLabel":"04/01/2020","Company":"Citigroup Corp.","RealDate":"2020-04-01T22:23:22+02:00"},{"PriceTarget":158.0,"InternalRating":"neutral","Date":1586463817000.0,"DateLabel":"04/09/2020","Company":"Deutsche Bank","RealDate":"2020-04-09T20:23:37+02:00"},{"PriceTarget":180.0,"InternalRating":"gut","Date":1588173802000.0,"DateLabel":"04/29/2020","Company":"Credit Suisse","RealDate":"2020-04-29T15:23:22+02:00"},{"PriceTarget":163.0,"InternalRating":"neutral","Date":1588173808000.0,"DateLabel":"04/29/2020","Company":"Deutsche Bank","RealDate":"2020-04-29T15:23:28+02:00"},{"PriceTarget":170.0,"InternalRating":"neutral","Date":1588191810000.0,"DateLabel":"04/29/2020","Company":"Bank of America Merrill Lynch","RealDate":"2020-04-29T20:23:30+02:00"},{"PriceTarget":154.0,"InternalRating":"schlecht","Date":1588191811000.0,"DateLabel":"04/29/2020","Company":"Barclays Capital","RealDate":"2020-04-29T20:23:31+02:00"},{"PriceTarget":170.0,"InternalRating":"neutral","Date":1588191816000.0,"DateLabel":"04/29/2020","Company":"Citigroup Corp.","RealDate":"2020-04-29T20:23:36+02:00"},{"PriceTarget":160.0,"InternalRating":"neutral","Date":1588353827000.0,"DateLabel":"05/01/2020","Company":"Morgan Stanley","RealDate":"2020-05-01T17:23:47+02:00"},{"PriceTarget":156.0,"InternalRating":"schlecht","Date":1594142603000.0,"DateLabel":"07/07/2020","Company":"Barclays Capital","RealDate":"2020-07-07T17:23:23+02:00"},{"PriceTarget":166.0,"InternalRating":"neutral","Date":1596032608000.0,"DateLabel":"07/29/2020","Company":"Morgan Stanley","RealDate":"2020-07-29T14:23:28+02:00"},{"PriceTarget":157.0,"InternalRating":"schlecht","Date":1596032610000.0,"DateLabel":"07/29/2020","Company":"Barclays Capital","RealDate":"2020-07-29T14:23:30+02:00"},{"PriceTarget":179.0,"InternalRating":"gut","Date":1596050617000.0,"DateLabel":"07/29/2020","Company":"Credit Suisse","RealDate":"2020-07-29T19:23:37+02:00"},{"PriceTarget":197.0,"InternalRating":"gut","Date":1600280608000.0,"DateLabel":"09/16/2020","Company":"Credit Suisse","RealDate":"2020-09-16T18:23:28+02:00"},{"PriceTarget":173.0,"InternalRating":"neutral","Date":1602602608000.0,"DateLabel":"10/13/2020","Company":"Morgan Stanley","RealDate":"2020-10-13T15:23:28+02:00"},{"PriceTarget":176.0,"InternalRating":"neutral","Date":1603898619000.0,"DateLabel":"10/28/2020","Company":"Morgan Stanley","RealDate":"2020-10-28T15:23:39+01:00"},{"PriceTarget":170.0,"InternalRating":"schlecht","Date":1610036610000.0,"DateLabel":"01/07/2021","Company":"Bank of America Merrill Lynch","RealDate":"2021-01-07T16:23:30+01:00"},{"PriceTarget":188.0,"InternalRating":"neutral","Date":1610468612000.0,"DateLabel":"01/12/2021","Company":"Morgan Stanley","RealDate":"2021-01-12T16:23:32+01:00"},{"PriceTarget":197.0,"InternalRating":"gut","Date":1611764596000.0,"DateLabel":"01/27/2021","Company":"Credit Suisse","RealDate":"2021-01-27T16:23:16+01:00"},{"PriceTarget":205.0,"InternalRating":"gut","Date":1611764605000.0,"DateLabel":"01/27/2021","Company":"J.P. Morgan","RealDate":"2021-01-27T16:23:25+01:00"},{"PriceTarget":200.0,"InternalRating":"gut","Date":1612376610000.0,"DateLabel":"02/03/2021","Company":"Argus Research Company ","RealDate":"2021-02-03T18:23:30+01:00"},{"PriceTarget":202.0,"InternalRating":"gut","Date":1616516611000.0,"DateLabel":"03/23/2021","Company":"Credit Suisse","RealDate":"2021-03-23T16:23:31+01:00"},{"PriceTarget":180.0,"InternalRating":"schlecht","Date":1617722607000.0,"DateLabel":"04/06/2021","Company":"Barclays Capital","RealDate":"2021-04-06T15:23:27+02:00"},{"PriceTarget":200.0,"InternalRating":"neutral","Date":1618262609000.0,"DateLabel":"04/12/2021","Company":"Morgan Stanley","RealDate":"2021-04-12T21:23:29+02:00"},{"PriceTarget":210.0,"InternalRating":"gut","Date":1619630604000.0,"DateLabel":"04/28/2021","Company":"Credit Suisse","RealDate":"2021-04-28T17:23:24+02:00"},{"PriceTarget":200.0,"InternalRating":"neutral","Date":1619630609000.0,"DateLabel":"04/28/2021","Company":"RBC Capital Markets","RealDate":"2021-04-28T17:23:29+02:00"},{"PriceTarget":212.0,"InternalRating":"neutral","Date":1625570594000.0,"DateLabel":"07/06/2021","Company":"Credit Suisse","RealDate":"2021-07-06T11:23:14+02:00"},{"PriceTarget":215.0,"InternalRating":"schlecht","Date":1626110608000.0,"DateLabel":"07/12/2021","Company":"Wolfe Research","RealDate":"2021-07-12T17:23:28+02:00"},{"PriceTarget":196.0,"InternalRating":"neutral","Date":1626290610000.0,"DateLabel":"07/14/2021","Company":"Deutsche Bank","RealDate":"2021-07-14T19:23:30+02:00"},{"PriceTarget":201.0,"InternalRating":"neutral","Date":1627496595000.0,"DateLabel":"07/28/2021","Company":"Deutsche Bank","RealDate":"2021-07-28T18:23:15+02:00"},{"PriceTarget":213.0,"InternalRating":"neutral","Date":1627496598000.0,"DateLabel":"07/28/2021","Company":"Morgan Stanley","RealDate":"2021-07-28T18:23:18+02:00"},{"PriceTarget":172.0,"InternalRating":"schlecht","Date":1631888598000.0,"DateLabel":"09/17/2021","Company":"UBS","RealDate":"2021-09-17T14:23:18+02:00"},{"PriceTarget":210.0,"InternalRating":"neutral","Date":1633346594000.0,"DateLabel":"10/04/2021","Company":"J.P. Morgan","RealDate":"2021-10-04T11:23:14+02:00"},{"PriceTarget":182.0,"InternalRating":"schlecht","Date":1633364596000.0,"DateLabel":"10/04/2021","Company":"Barclays Capital","RealDate":"2021-10-04T16:23:16+02:00"},{"PriceTarget":193.0,"InternalRating":"neutral","Date":1633634599000.0,"DateLabel":"10/07/2021","Company":"Morgan Stanley","RealDate":"2021-10-07T19:23:19+02:00"},{"PriceTarget":179.0,"InternalRating":"neutral","Date":1633706620000.0,"DateLabel":"10/08/2021","Company":"Wells Fargo & Co","RealDate":"2021-10-08T15:23:40+02:00"},{"PriceTarget":201.0,"InternalRating":"neutral","Date":1635362601000.0,"DateLabel":"10/27/2021","Company":"Credit Suisse","RealDate":"2021-10-27T19:23:21+02:00"},{"PriceTarget":194.0,"InternalRating":"neutral","Date":1635362602000.0,"DateLabel":"10/27/2021","Company":"Morgan Stanley","RealDate":"2021-10-27T19:23:22+02:00"},{"PriceTarget":199.0,"InternalRating":"neutral","Date":1638548616000.0,"DateLabel":"12/03/2021","Company":"RBC Capital Markets","RealDate":"2021-12-03T16:23:36+01:00"},{"PriceTarget":182.0,"InternalRating":"neutral","Date":1639160608000.0,"DateLabel":"12/10/2021","Company":"Deutsche Bank","RealDate":"2021-12-10T18:23:28+01:00"},{"PriceTarget":198.0,"InternalRating":"neutral","Date":1639574594000.0,"DateLabel":"12/15/2021","Company":"Credit Suisse","RealDate":"2021-12-15T13:23:14+01:00"},{"PriceTarget":180.0,"InternalRating":"neutral","Date":1639754633000.0,"DateLabel":"12/17/2021","Company":"Mizuho","RealDate":"2021-12-17T15:23:53+01:00"}]},
    regionId: 'analysis-chart-xcsdf4234'
});
</script>									<div class="spacer-50 mobile-spacer-25"></div>

<div class="graviton">
			<h2 class="header-underline">Analyst Opinions for 3M Co.</h2>

		<div class="grid--d-flex grid--justify-content-end">
			<div class="dropdown dropdown--m-stretch" data-table-filter="5639df7517874b6fba64f3f1850fdcff" data-table-filter-type="dropdown">
				<button class="dropdown__trigger button button--with-icon button--m-stretch button--s-stretch margin-bottom--smaller">
					<span class="button__label">All</span>
					<span class="icon icon-arrow-down icon--size-small"></span>
				</button>

				<div class="dropdown__content listing listing--selectable-items">
					<ul class="listing__list">
						<li class="listing__item" data-filter-index="-1" data-filter-value="all"><span class="listing__text">All</span></li>
							<li class="listing__item" data-filter-index="6" data-filter-value="gut"><span class="listing__text">Buy</span></li>
							<li class="listing__item" data-filter-index="6" data-filter-value="neutral"><span class="listing__text">Hold</span></li>
							<li class="listing__item" data-filter-index="6" data-filter-value="schlecht"><span class="listing__text">Sell</span></li>
					</ul>
				</div>
			</div>
		</div>

	<div class="grid--vertical-scrolling">
	<table class="table table--fixed table--suppresses-line-breaks" data-table-filter-table="5639df7517874b6fba64f3f1850fdcff">
		<tbody class="table__tbody">
					<tr class="table__tr">
									<td class="table__td"  >
										12/17/21
									</td>
									<td class="table__td"  >

									</td>
									<td class="table__td"  >
										Mizuho
									</td>
									<td class="table__td"  >
										<div class="image_icon_price_triangle_grey"></div>
									</td>
									<td class="table__td"  >
										Maintained Hold
									</td>
									<td class="table__td"  >
										$180
									</td>
									<td class="table__td hidden"  >
										neutral
									</td>
					</tr>
					<tr class="table__tr">
									<td class="table__td"  >
										12/15/21
									</td>
									<td class="table__td"  >

									</td>
									<td class="table__td"  >
										Credit Suisse
									</td>
									<td class="table__td"  >
										<div class="image_icon_price_triangle_grey"></div>
									</td>
									<td class="table__td"  >
										Maintained Hold
									</td>
									<td class="table__td"  >
										$198
									</td>
									<td class="table__td hidden"  >
										neutral
									</td>
					</tr>
					<tr class="table__tr">
									<td class="table__td"  >
										12/10/21
									</td>
									<td class="table__td"  >

									</td>
									<td class="table__td"  >
										Deutsche Bank
									</td>
									<td class="table__td"  >
										<div class="image_icon_price_triangle_grey"></div>
									</td>
									<td class="table__td"  >
										Maintained Hold
									</td>
									<td class="table__td"  >
										$182
									</td>
									<td class="table__td hidden"  >
										neutral
									</td>
					</tr>
					<tr class="table__tr">
									<td class="table__td"  >
										12/03/21
									</td>
									<td class="table__td"  >

									</td>
									<td class="table__td"  >
										RBC Capital Markets
									</td>
									<td class="table__td"  >
										<div class="image_icon_price_triangle_grey"></div>
									</td>
									<td class="table__td"  >
										Maintained Hold
									</td>
									<td class="table__td"  >
										$199
									</td>
									<td class="table__td hidden"  >
										neutral
									</td>
					</tr>
					<tr class="table__tr">
									<td class="table__td"  >
										10/27/21
									</td>
									<td class="table__td"  >

									</td>
									<td class="table__td"  >
										Credit Suisse
									</td>
									<td class="table__td"  >
										<div class="image_icon_price_triangle_grey"></div>
									</td>
									<td class="table__td"  >
										Maintained Hold
									</td>
									<td class="table__td"  >
										$201
									</td>
									<td class="table__td hidden"  >
										neutral
									</td>
					</tr>
					<tr class="table__tr">
									<td class="table__td"  >
										10/27/21
									</td>
									<td class="table__td"  >

									</td>
									<td class="table__td"  >
										Morgan Stanley
									</td>
									<td class="table__td"  >
										<div class="image_icon_price_triangle_grey"></div>
									</td>
									<td class="table__td"  >
										Maintained Hold
									</td>
									<td class="table__td"  >
										$194
									</td>
									<td class="table__td hidden"  >
										neutral
									</td>
					</tr>
					<tr class="table__tr">
									<td class="table__td"  >
										10/08/21
									</td>
									<td class="table__td"  >

									</td>
									<td class="table__td"  >
										Wells Fargo & Co
									</td>
									<td class="table__td"  >
										<div class="image_icon_price_triangle_grey"></div>
									</td>
									<td class="table__td"  >
										Maintained Hold
									</td>
									<td class="table__td"  >
										$179
									</td>
									<td class="table__td hidden"  >
										neutral
									</td>
					</tr>
					<tr class="table__tr">
									<td class="table__td"  >
										10/07/21
									</td>
									<td class="table__td"  >

									</td>
									<td class="table__td"  >
										Morgan Stanley
									</td>
									<td class="table__td"  >
										<div class="image_icon_price_triangle_grey"></div>
									</td>
									<td class="table__td"  >
										Maintained Hold
									</td>
									<td class="table__td"  >
										$193
									</td>
									<td class="table__td hidden"  >
										neutral
									</td>
					</tr>
					<tr class="table__tr">
									<td class="table__td"  >
										10/04/21
									</td>
									<td class="table__td"  >

									</td>
									<td class="table__td"  >
										Barclays Capital
									</td>
									<td class="table__td"  >
										<div class="image_icon_price_triangle_red"></div>
									</td>
									<td class="table__td"  >
										Maintained Sell
									</td>
									<td class="table__td"  >
										$182
									</td>
									<td class="table__td hidden"  >
										schlecht
									</td>
					</tr>
					<tr class="table__tr">
									<td class="table__td"  >
										10/04/21
									</td>
									<td class="table__td"  >

									</td>
									<td class="table__td"  >
										J.P. Morgan
									</td>
									<td class="table__td"  >
										<div class="image_icon_price_triangle_grey"></div>
									</td>
									<td class="table__td"  >
										Downgraded to Hold
									</td>
									<td class="table__td"  >
										$210
									</td>
									<td class="table__td hidden"  >
										neutral
									</td>
					</tr>
					<tr class="table__tr">
									<td class="table__td"  >
										09/17/21
									</td>
									<td class="table__td"  >

									</td>
									<td class="table__td"  >
										UBS
									</td>
									<td class="table__td"  >
										<div class="image_icon_price_triangle_red"></div>
									</td>
									<td class="table__td"  >
										Maintained Sell
									</td>
									<td class="table__td"  >
										$172
									</td>
									<td class="table__td hidden"  >
										schlecht
									</td>
					</tr>
					<tr class="table__tr">
									<td class="table__td"  >
										07/28/21
									</td>
									<td class="table__td"  >

									</td>
									<td class="table__td"  >
										Deutsche Bank
									</td>
									<td class="table__td"  >
										<div class="image_icon_price_triangle_grey"></div>
									</td>
									<td class="table__td"  >
										Maintained Hold
									</td>
									<td class="table__td"  >
										$201
									</td>
									<td class="table__td hidden"  >
										neutral
									</td>
					</tr>
					<tr class="table__tr">
									<td class="table__td"  >
										07/28/21
									</td>
									<td class="table__td"  >

									</td>
									<td class="table__td"  >
										Morgan Stanley
									</td>
									<td class="table__td"  >
										<div class="image_icon_price_triangle_grey"></div>
									</td>
									<td class="table__td"  >
										Maintained Hold
									</td>
									<td class="table__td"  >
										$213
									</td>
									<td class="table__td hidden"  >
										neutral
									</td>
					</tr>
					<tr class="table__tr">
									<td class="table__td"  >
										07/14/21
									</td>
									<td class="table__td"  >

									</td>
									<td class="table__td"  >
										Deutsche Bank
									</td>
									<td class="table__td"  >
										<div class="image_icon_price_triangle_grey"></div>
									</td>
									<td class="table__td"  >
										Maintained Hold
									</td>
									<td class="table__td"  >
										$196
									</td>
									<td class="table__td hidden"  >
										neutral
									</td>
					</tr>
					<tr class="table__tr">
									<td class="table__td"  >
										07/12/21
									</td>
									<td class="table__td"  >

									</td>
									<td class="table__td"  >
										Wolfe Research
									</td>
									<td class="table__td"  >
										<div class="image_icon_price_triangle_red"></div>
									</td>
									<td class="table__td"  >
										Downgraded to Sell
									</td>
									<td class="table__td"  >
										$215
									</td>
									<td class="table__td hidden"  >
										schlecht
									</td>
					</tr>
					<tr class="table__tr">
									<td class="table__td"  >
										07/06/21
									</td>
									<td class="table__td"  >

									</td>
									<td class="table__td"  >
										Credit Suisse
									</td>
									<td class="table__td"  >
										<div class="image_icon_price_triangle_grey"></div>
									</td>
									<td class="table__td"  >
										Downgraded to Hold
									</td>
									<td class="table__td"  >
										$212
									</td>
									<td class="table__td hidden"  >
										neutral
									</td>
					</tr>
					<tr class="table__tr">
									<td class="table__td"  >
										04/28/21
									</td>
									<td class="table__td"  >

									</td>
									<td class="table__td"  >
										Credit Suisse
									</td>
									<td class="table__td"  >
										<div class="image_icon_price_triangle_green"></div>
									</td>
									<td class="table__td"  >
										Maintained Buy
									</td>
									<td class="table__td"  >
										$210
									</td>
									<td class="table__td hidden"  >
										gut
									</td>
					</tr>
					<tr class="table__tr">
									<td class="table__td"  >
										04/28/21
									</td>
									<td class="table__td"  >

									</td>
									<td class="table__td"  >
										RBC Capital Markets
									</td>
									<td class="table__td"  >
										<div class="image_icon_price_triangle_grey"></div>
									</td>
									<td class="table__td"  >
										Maintained Hold
									</td>
									<td class="table__td"  >
										$200
									</td>
									<td class="table__td hidden"  >
										neutral
									</td>
					</tr>
					<tr class="table__tr">
									<td class="table__td"  >
										04/12/21
									</td>
									<td class="table__td"  >

									</td>
									<td class="table__td"  >
										Morgan Stanley
									</td>
									<td class="table__td"  >
										<div class="image_icon_price_triangle_grey"></div>
									</td>
									<td class="table__td"  >
										Maintained Hold
									</td>
									<td class="table__td"  >
										$200
									</td>
									<td class="table__td hidden"  >
										neutral
									</td>
					</tr>
					<tr class="table__tr">
									<td class="table__td"  >
										04/06/21
									</td>
									<td class="table__td"  >

									</td>
									<td class="table__td"  >
										Barclays Capital
									</td>
									<td class="table__td"  >
										<div class="image_icon_price_triangle_red"></div>
									</td>
									<td class="table__td"  >
										Maintained Sell
									</td>
									<td class="table__td"  >
										$180
									</td>
									<td class="table__td hidden"  >
										schlecht
									</td>
					</tr>
					<tr class="table__tr">
									<td class="table__td"  >
										03/23/21
									</td>
									<td class="table__td"  >

									</td>
									<td class="table__td"  >
										Credit Suisse
									</td>
									<td class="table__td"  >
										<div class="image_icon_price_triangle_green"></div>
									</td>
									<td class="table__td"  >
										Maintained Buy
									</td>
									<td class="table__td"  >
										$202
									</td>
									<td class="table__td hidden"  >
										gut
									</td>
					</tr>
					<tr class="table__tr">
									<td class="table__td"  >
										02/03/21
									</td>
									<td class="table__td"  >

									</td>
									<td class="table__td"  >
										Argus Research Company
									</td>
									<td class="table__td"  >
										<div class="image_icon_price_triangle_green"></div>
									</td>
									<td class="table__td"  >
										Upgraded to Buy
									</td>
									<td class="table__td"  >
										$200
									</td>
									<td class="table__td hidden"  >
										gut
									</td>
					</tr>
					<tr class="table__tr">
									<td class="table__td"  >
										01/27/21
									</td>
									<td class="table__td"  >

									</td>
									<td class="table__td"  >
										Credit Suisse
									</td>
									<td class="table__td"  >
										<div class="image_icon_price_triangle_green"></div>
									</td>
									<td class="table__td"  >
										Maintained Buy
									</td>
									<td class="table__td"  >
										$197
									</td>
									<td class="table__td hidden"  >
										gut
									</td>
					</tr>
					<tr class="table__tr">
									<td class="table__td"  >
										01/27/21
									</td>
									<td class="table__td"  >

									</td>
									<td class="table__td"  >
										J.P. Morgan
									</td>
									<td class="table__td"  >
										<div class="image_icon_price_triangle_green"></div>
									</td>
									<td class="table__td"  >
										Upgraded to Buy
									</td>
									<td class="table__td"  >
										$205
									</td>
									<td class="table__td hidden"  >
										gut
									</td>
					</tr>
					<tr class="table__tr">
									<td class="table__td"  >
										01/12/21
									</td>
									<td class="table__td"  >

									</td>
									<td class="table__td"  >
										Morgan Stanley
									</td>
									<td class="table__td"  >
										<div class="image_icon_price_triangle_grey"></div>
									</td>
									<td class="table__td"  >
										Maintained Hold
									</td>
									<td class="table__td"  >
										$188
									</td>
									<td class="table__td hidden"  >
										neutral
									</td>
					</tr>
					<tr class="table__tr">
									<td class="table__td"  >
										01/07/21
									</td>
									<td class="table__td"  >

									</td>
									<td class="table__td"  >
										Bank of America Merrill Lynch
									</td>
									<td class="table__td"  >
										<div class="image_icon_price_triangle_red"></div>
									</td>
									<td class="table__td"  >
										Downgraded to Sell
									</td>
									<td class="table__td"  >
										$170
									</td>
									<td class="table__td hidden"  >
										schlecht
									</td>
					</tr>
					<tr class="table__tr">
									<td class="table__td"  >
										10/28/20
									</td>
									<td class="table__td"  >

									</td>
									<td class="table__td"  >
										Morgan Stanley
									</td>
									<td class="table__td"  >
										<div class="image_icon_price_triangle_grey"></div>
									</td>
									<td class="table__td"  >
										Maintained Hold
									</td>
									<td class="table__td"  >
										$176
									</td>
									<td class="table__td hidden"  >
										neutral
									</td>
					</tr>
					<tr class="table__tr">
									<td class="table__td"  >
										10/13/20
									</td>
									<td class="table__td"  >

									</td>
									<td class="table__td"  >
										Morgan Stanley
									</td>
									<td class="table__td"  >
										<div class="image_icon_price_triangle_grey"></div>
									</td>
									<td class="table__td"  >
										Maintained Hold
									</td>
									<td class="table__td"  >
										$173
									</td>
									<td class="table__td hidden"  >
										neutral
									</td>
					</tr>
					<tr class="table__tr">
									<td class="table__td"  >
										10/07/20
									</td>
									<td class="table__td"  >

									</td>
									<td class="table__td"  >
										Gordon Haskett
									</td>
									<td class="table__td"  >
										<div class="image_icon_price_triangle_grey"></div>
									</td>
									<td class="table__td"  >
										Maintained Hold
									</td>
									<td class="table__td"  >

									</td>
									<td class="table__td hidden"  >
										neutral
									</td>
					</tr>
					<tr class="table__tr">
									<td class="table__td"  >
										09/16/20
									</td>
									<td class="table__td"  >

									</td>
									<td class="table__td"  >
										Credit Suisse
									</td>
									<td class="table__td"  >
										<div class="image_icon_price_triangle_green"></div>
									</td>
									<td class="table__td"  >
										Maintained Buy
									</td>
									<td class="table__td"  >
										$197
									</td>
									<td class="table__td hidden"  >
										gut
									</td>
					</tr>
					<tr class="table__tr">
									<td class="table__td"  >
										07/29/20
									</td>
									<td class="table__td"  >

									</td>
									<td class="table__td"  >
										Credit Suisse
									</td>
									<td class="table__td"  >
										<div class="image_icon_price_triangle_green"></div>
									</td>
									<td class="table__td"  >
										Maintained Buy
									</td>
									<td class="table__td"  >
										$179
									</td>
									<td class="table__td hidden"  >
										gut
									</td>
					</tr>
					<tr class="table__tr">
									<td class="table__td"  >
										07/29/20
									</td>
									<td class="table__td"  >

									</td>
									<td class="table__td"  >
										Morgan Stanley
									</td>
									<td class="table__td"  >
										<div class="image_icon_price_triangle_grey"></div>
									</td>
									<td class="table__td"  >
										Maintained Hold
									</td>
									<td class="table__td"  >
										$166
									</td>
									<td class="table__td hidden"  >
										neutral
									</td>
					</tr>
					<tr class="table__tr">
									<td class="table__td"  >
										07/29/20
									</td>
									<td class="table__td"  >

									</td>
									<td class="table__td"  >
										Barclays Capital
									</td>
									<td class="table__td"  >
										<div class="image_icon_price_triangle_red"></div>
									</td>
									<td class="table__td"  >
										Maintained Sell
									</td>
									<td class="table__td"  >
										$157
									</td>
									<td class="table__td hidden"  >
										schlecht
									</td>
					</tr>
					<tr class="table__tr">
									<td class="table__td"  >
										07/07/20
									</td>
									<td class="table__td"  >

									</td>
									<td class="table__td"  >
										Barclays Capital
									</td>
									<td class="table__td"  >
										<div class="image_icon_price_triangle_red"></div>
									</td>
									<td class="table__td"  >
										Maintained Sell
									</td>
									<td class="table__td"  >
										$156
									</td>
									<td class="table__td hidden"  >
										schlecht
									</td>
					</tr>
					<tr class="table__tr">
									<td class="table__td"  >
										05/01/20
									</td>
									<td class="table__td"  >

									</td>
									<td class="table__td"  >
										Morgan Stanley
									</td>
									<td class="table__td"  >
										<div class="image_icon_price_triangle_grey"></div>
									</td>
									<td class="table__td"  >
										Maintained Hold
									</td>
									<td class="table__td"  >
										$160
									</td>
									<td class="table__td hidden"  >
										neutral
									</td>
					</tr>
					<tr class="table__tr">
									<td class="table__td"  >
										04/29/20
									</td>
									<td class="table__td"  >

									</td>
									<td class="table__td"  >
										Bank of America Merrill Lynch
									</td>
									<td class="table__td"  >
										<div class="image_icon_price_triangle_grey"></div>
									</td>
									<td class="table__td"  >
										Maintained Hold
									</td>
									<td class="table__td"  >
										$170
									</td>
									<td class="table__td hidden"  >
										neutral
									</td>
					</tr>
					<tr class="table__tr">
									<td class="table__td"  >
										04/29/20
									</td>
									<td class="table__td"  >

									</td>
									<td class="table__td"  >
										Barclays Capital
									</td>
									<td class="table__td"  >
										<div class="image_icon_price_triangle_red"></div>
									</td>
									<td class="table__td"  >
										Maintained Sell
									</td>
									<td class="table__td"  >
										$154
									</td>
									<td class="table__td hidden"  >
										schlecht
									</td>
					</tr>
					<tr class="table__tr">
									<td class="table__td"  >
										04/29/20
									</td>
									<td class="table__td"  >

									</td>
									<td class="table__td"  >
										Citigroup Corp.
									</td>
									<td class="table__td"  >
										<div class="image_icon_price_triangle_grey"></div>
									</td>
									<td class="table__td"  >
										Maintained Hold
									</td>
									<td class="table__td"  >
										$170
									</td>
									<td class="table__td hidden"  >
										neutral
									</td>
					</tr>
					<tr class="table__tr">
									<td class="table__td"  >
										04/29/20
									</td>
									<td class="table__td"  >

									</td>
									<td class="table__td"  >
										Credit Suisse
									</td>
									<td class="table__td"  >
										<div class="image_icon_price_triangle_green"></div>
									</td>
									<td class="table__td"  >
										Maintained Buy
									</td>
									<td class="table__td"  >
										$180
									</td>
									<td class="table__td hidden"  >
										gut
									</td>
					</tr>
					<tr class="table__tr">
									<td class="table__td"  >
										04/29/20
									</td>
									<td class="table__td"  >

									</td>
									<td class="table__td"  >
										Deutsche Bank
									</td>
									<td class="table__td"  >
										<div class="image_icon_price_triangle_grey"></div>
									</td>
									<td class="table__td"  >
										Maintained Hold
									</td>
									<td class="table__td"  >
										$163
									</td>
									<td class="table__td hidden"  >
										neutral
									</td>
					</tr>
					<tr class="table__tr">
									<td class="table__td"  >
										04/09/20
									</td>
									<td class="table__td"  >

									</td>
									<td class="table__td"  >
										Deutsche Bank
									</td>
									<td class="table__td"  >
										<div class="image_icon_price_triangle_grey"></div>
									</td>
									<td class="table__td"  >
										Maintained Hold
									</td>
									<td class="table__td"  >
										$158
									</td>
									<td class="table__td hidden"  >
										neutral
									</td>
					</tr>
					<tr class="table__tr">
									<td class="table__td"  >
										04/01/20
									</td>
									<td class="table__td"  >

									</td>
									<td class="table__td"  >
										Citigroup Corp.
									</td>
									<td class="table__td"  >
										<div class="image_icon_price_triangle_grey"></div>
									</td>
									<td class="table__td"  >
										Maintained Hold
									</td>
									<td class="table__td"  >
										$146
									</td>
									<td class="table__td hidden"  >
										neutral
									</td>
					</tr>
					<tr class="table__tr">
									<td class="table__td"  >
										03/30/20
									</td>
									<td class="table__td"  >

									</td>
									<td class="table__td"  >
										Gordon Haskett
									</td>
									<td class="table__td"  >
										<div class="image_icon_price_triangle_red"></div>
									</td>
									<td class="table__td"  >
										Maintained Sell
									</td>
									<td class="table__td"  >

									</td>
									<td class="table__td hidden"  >
										schlecht
									</td>
					</tr>
					<tr class="table__tr">
									<td class="table__td"  >
										03/27/20
									</td>
									<td class="table__td"  >

									</td>
									<td class="table__td"  >
										Goldman Sachs
									</td>
									<td class="table__td"  >
										<div class="image_icon_price_triangle_grey"></div>
									</td>
									<td class="table__td"  >
										Maintained Hold
									</td>
									<td class="table__td"  >
										$159
									</td>
									<td class="table__td hidden"  >
										neutral
									</td>
					</tr>
					<tr class="table__tr">
									<td class="table__td"  >
										03/17/20
									</td>
									<td class="table__td"  >

									</td>
									<td class="table__td"  >
										Morgan Stanley
									</td>
									<td class="table__td"  >
										<div class="image_icon_price_triangle_grey"></div>
									</td>
									<td class="table__td"  >
										Maintained Hold
									</td>
									<td class="table__td"  >
										$156
									</td>
									<td class="table__td hidden"  >
										neutral
									</td>
					</tr>
		</tbody>
	</table>
	</div>




</div>


									<div class="spacer-50 mobile-spacer-25"></div>

		<div class="htlad-mobile_in_post_ad_1"
				 data-htlad="true"
				 data-unit="Markets-Insider/Stocks/Quote"
				 data-prebid="0x0:Stocks/Quote/medrec_flex|768x0:"></div>

		<div class="htlad-desktop_in_post_ad_1"
				 data-htlad="true"
				 data-unit="Markets-Insider/Stocks/Quote"
				 data-prebid="0x0:|768x0:Stocks/Quote/medrec|1261x0:Stocks/Quote/billboard_flex"></div>


<div class="graviton">
					<h2 class="header-underline">Estimates* for 3M Co. in USD</h2>

		<div class="tab-region" data-tab-region="funds-performances">
			<nav class="tab-region__navigation">
				<div class="tab" data-tab="funds-performances">
					<ul class="tab__list">
						<li class="tab__item" data-tab-item="yearly">Yearly</li>
						<li class="tab__item" data-tab-item="quarterly">Quarterly</li>
					</ul>
				</div>
			</nav>

			<div class="tab-region__container">
					<div class="grid--vertical-scrolling tab-region__content" data-tab-region-content="yearly">
		<table class="table table--fixed table--suppresses-line-breaks table--col-2-text-align-right table--col-3-text-align-right table--col-4-text-align-right table--col-5-text-align-right table--col-6-text-align-right">
			<thead class="table__thead">
				<tr class="table__tr">
					<th class="table__th">&nbsp;</th>
							<th class="table__th text-right">2021</th>
							<th class="table__th text-right">2022</th>
							<th class="table__th text-right">2023</th>
							<th class="table__th text-right">2024</th>

				</tr>
			</thead>
			<tbody class="table__tbody">
					<tr class="table__tr">
						<td class="table__td black" width="25%">Revenue</td>

								<td width="18%" class="table__td text-right" >
									35,336
								</td>
								<td width="18%" class="table__td text-right" >
									36,621
								</td>
								<td width="18%" class="table__td text-right" >
									37,930
								</td>
								<td width="18%" class="table__td text-right" >
									39,876
								</td>
					</tr>
					<tr class="table__tr">
						<td class="table__td black" width="25%">Dividend</td>

								<td width="18%" class="table__td text-right" >
									5.88
								</td>
								<td width="18%" class="table__td text-right" >
									6.09
								</td>
								<td width="18%" class="table__td text-right" >
									6.28
								</td>
								<td width="18%" class="table__td text-right" >
									6.24
								</td>
					</tr>
					<tr class="table__tr">
						<td class="table__td black" width="25%">Dividend Yield (in %)</td>

								<td width="18%" class="table__td text-right" >
									3.29 %
								</td>
								<td width="18%" class="table__td text-right" >
									3.40 %
								</td>
								<td width="18%" class="table__td text-right" >
									3.50 %
								</td>
								<td width="18%" class="table__td text-right" >
									3.47 %
								</td>
					</tr>
					<tr class="table__tr">
						<td class="table__td black" width="25%">EPS</td>

								<td width="18%" class="table__td text-right" >
									9.84
								</td>
								<td width="18%" class="table__td text-right" >
									10.41
								</td>
								<td width="18%" class="table__td text-right" >
									11.14
								</td>
								<td width="18%" class="table__td text-right" >
									11.91
								</td>
					</tr>
					<tr class="table__tr">
						<td class="table__td black" width="25%">P/E Ratio</td>

								<td width="18%" class="table__td text-right" >
									18.03
								</td>
								<td width="18%" class="table__td text-right" >
									16.84
								</td>
								<td width="18%" class="table__td text-right" >
									15.76
								</td>
								<td width="18%" class="table__td text-right" >
									14.59
								</td>
					</tr>
					<tr class="table__tr">
						<td class="table__td black" width="25%">EBIT</td>

								<td width="18%" class="table__td text-right" >
									7,356
								</td>
								<td width="18%" class="table__td text-right" >
									7,888
								</td>
								<td width="18%" class="table__td text-right" >
									8,362
								</td>
								<td width="18%" class="table__td text-right" >
									8,705
								</td>
					</tr>
					<tr class="table__tr">
						<td class="table__td black" width="25%">EBITDA</td>

								<td width="18%" class="table__td text-right" >
									9,256
								</td>
								<td width="18%" class="table__td text-right" >
									9,748
								</td>
